title,company_name,location,via,description,job_id,qualifications,responsibilities,benefits,highlights,posted_at,schedule_type,work_from_home
Data Scientist,Merck,"Cambridge, MA, USA ", Merck Careers,"Job Description The Digital Operations and Innovation (DOI) group in the Nonclinical Drug Safety (NDS) Operations department is seeking a motivated Data Scientist to support our efforts to modernize, harmonize, and integrate NDS data. DOI's mission is to advance non-clinical drug safety through the application of data science. Our team's solutions support scientific and business leaders by... facilitating data access, expanding analysis capabilities, and driving novel insights. The candidate will be part of a collaborative team comprised of biologists, chemists, pharmacologists, business/IT professionals, and data scientists. The role will provide essential contributions to our research and development division and NDS' commitment to be an industry leader in the application of data science to impact the evaluation of drug safety. The candidate will have the opportunity to support data science projects related to both scientific and business problems. Job Responsibilities:  Collaborate with NDS subject matter experts to understand data needs and problems  Propose and design solutions that support data capture, exploration, modeling, visualization, and/or search  Contribute to efforts to ingest and harmonize data from non-clinical drug safety sources  Work closely with IT colleagues to evaluate commercially available solutions that augment DOI's capabilities  Create informative and interactive visualizations that enable discovery, support hypotheses, or provide insights into organizational health Minimum education and Experience:  Masters degree with 3+ years' experience or PhD with 0+ years' experience in computer science, computer engineering, biomedical engineering, data science, statistics, or a related field or Required Experience and Skills:  Proficiency building dashboards using one or more visualization tools such as PowerBI, Spotfire, and/or RShiny  Proficiency with programming languages such as Python and R (Python preferred)  Proficiency using data science packages such as Pandas, Numpy, Scikit-learn, and Scipy  Ability to quickly evaluate and integrate new technologies and communicate their value to stakeholders  Strong collaboration and English communication skills  10-20% travel Preferred Experience and Skills:  Experience with SQL, XML, json, and RESTful APIs  Familiarity with data sources, such as Oracle, RedShift, postgres, mongoDB, and/or neo4j  Familiarity with deep learning frameworks such as PyTorch or TensorFlow  Familiarity with graphing packages and languages such as Plotly and D3.js  Experience in distributed or cloud computing environments (AWS, Azure, etc)  Experience with version control and good code reproducibility practices (git, documentation, etc.) We are a research-driven biopharmaceutical company. Our mission is built on the simple premise that if we “follow the science” that great medicines can make a significant impact to our world. We believe that a research-driven enterprise dedicated to world-class science can succeed by inventing medicine and vaccine innovations that make a difference for patients across the globe. Who we are … We are known as Merck & Co., Inc., Rahway, New Jersey, USA in the United States and Canada and MSD everywhere else. For more than a century, we have been inventing for life, bringing forward medicines and vaccines for many of the world's most challenging diseases. Today, our company continues to be at the forefront of research to deliver innovative health solutions and advance the prevention and treatment of diseases that threaten people and animals around the world. What we look for … Imagine getting up in the morning for a job as important as helping to save and improve lives around the world. Here, you have that opportunity. You can put your empathy, creativity, digital mastery, or scientific genius to work in collaboration with a diverse group of colleagues who pursue and bring hope to countless people who are battling some of the most challenging diseases of our time. Our team is constantly evolving, so if you are among the intellectually curious, join us—and start making your impact today. NOTICE FOR INTERNAL APPLICANTS In accordance with Managers' Policy - Job Posting and Employee Placement, all employees subject to this policy are required to have a minimum of twelve (12) months of service in current position prior to applying for open positions. If you have been offered a separation benefits package, but have not yet reached your separation date and are offered a position within the salary and geographical parameters as set forth in the Summary Plan Description (SPD) of your separation package, then you are no longer eligible for your separation benefits package. To discuss in more detail, please contact your HRBP or Talent Acquisition Advisor. Residents of Colorado Click here to request this role’s pay range. Employees working in roles that the Company determines require routine collaboration with external stakeholders, such as customer-facing commercial, or research-based roles, will be expected to comply not only with Company policy but also with policies established by such external stakeholders (for example, a requirement to be vaccinated against COVID-19 in order to access a facility or meet with stakeholders). Please understand that, as permitted by applicable law, if you have not been vaccinated against COVID-19 and an essential function of your job is to call on external stakeholders who require vaccination to enter their premises or engage in face-to-face meetings, then your employment may pose an undue burden to business operations, in which case you may not be offered employment, or your employment could be terminated. Please also note that, where permitted by applicable law, the Company reserves the right to require COVID-19 vaccinations for positions, such as in Global Employee Health, where the Company determines in its discretion that the nature of the role presents an increased risk of disease transmission. Current Employees apply HERE Current Contingent Workers apply HERE US and Puerto Rico Residents Only: Our company is committed to inclusion, ensuring that candidates can engage in a hiring process that exhibits their true capabilities. Please click here if you need an accommodation during the application or hiring process. For more information about personal rights under Equal Employment Opportunity, visit: EEOC Know Your Rights EEOC GINA Supplement​ Pay Transparency Nondiscrimination We are proud to be a company that embraces the value of bringing diverse, talented, and committed people together. The fastest way to breakthrough innovation is when diverse ideas come together in an inclusive environment. We encourage our colleagues to respectfully challenge one another’s thinking and approach problems collectively. We are an equal opportunity employer, committed to fostering an inclusive and diverse workplace. Residents of Colorado: Click here to request this role’s pay range. Learn more about your rights, including under California, Colorado and other US State Acts Search Firm Representatives Please Read Carefully Merck & Co., Inc., Rahway, NJ, USA, also known as Merck Sharp & Dohme LLC, Rahway, NJ, USA, does not accept unsolicited assistance from search firms for employment opportunities. All CVs / resumes submitted by search firms to any employee at our company without a valid written search agreement in place for this position will be deemed the sole property of our company. No fee will be paid in the event a candidate is hired by our company as a result of an agency referral where no pre-existing agreement is in place. Where agency agreements are in place, introductions are position specific. Please, no phone calls or emails. Employee Status: Regular Relocation: Domestic/International VISA Sponsorship: Yes Travel Requirements: 10% Flexible Work Arrangements: Hybrid, Remote Work Shift: 1st - Day Valid Driving License: No Hazardous Material(s): Requisition ID:R226607",eyJqb2JfdGl0bGUiOiJEYXRhIFNjaWVudGlzdCIsImh0aWRvY2lkIjoiaUlobUVtU3NydFFBQUFBQUFBQUFBQT09IiwiZ2wiOiJ1ayIsImhsIjoiZW4iLCJmYyI6IkVzc0JDb3dCUVVOUWQycHFWRXBTVjFoNlNEUkxTMkZtYkZkbVZtSldOMGxEVGxkR1VXVjFaM1ZLTUhKTmJHVTFOMFpKYTFSNVprSllPVGRHWkhKdFMzZzBhVFJPUVVaR1dYTlJWRXhpV25oQmFEUTFWMGN0WmtkR01HMVNNMlJ1TVdWUU5qVTVUSFkxVVdzM1NtZHFZekY1TjFsWVowdFpURTFyVGtzeFVWWnJaRTlDT1RsRGNqQTBRbmR0T0V4b1l6VVNGaTFSVUMxWk5qSjBSVnBJVFRsQlQzSTVTME5SUkVFYUlrRkdYelpOUVU5NmJucHNYMlZzTWt4clQySTBRVkZ1ZVRKMFdrMVplblZGZUVFIiwiZmN2IjoiMyIsImZjX2lkIjoiZmNfOCIsImFwcGx5X2xpbmsiOnsidGl0bGUiOiJBcHBseSBkaXJlY3RseSBvbiBNZXJjayBDYXJlZXJzIiwibGluayI6Imh0dHBzOi8vam9icy5tZXJjay5jb20vdXMvZW4vam9iL1IyMjY2MDcvRGF0YS1TY2llbnRpc3Q/dXRtX2NhbXBhaWduPWdvb2dsZV9qb2JzX2FwcGx5XHUwMDI2dXRtX3NvdXJjZT1nb29nbGVfam9ic19hcHBseVx1MDAyNnV0bV9tZWRpdW09b3JnYW5pYyJ9fQ==,"[""Masters degree with 3+ years' experience or PhD with 0+ years' experience in computer science, computer engineering, biomedical engineering, data science, statistics, or a related field or"", 'Proficiency building dashboards using one or more visualization tools such as PowerBI, Spotfire, and/or RShiny', 'Proficiency using data science packages such as Pandas, Numpy, Scikit-learn, and Scipy', 'Ability to quickly evaluate and integrate new technologies and communicate their value to stakeholders', 'Strong collaboration and English communication skills', '10-20% travel']","[""DOI's mission is to advance non-clinical drug safety through the application of data science"", 'The candidate will be part of a collaborative team comprised of biologists, chemists, pharmacologists, business/IT professionals, and data scientists', ""The role will provide essential contributions to our research and development division and NDS' commitment to be an industry leader in the application of data science to impact the evaluation of drug safety"", 'The candidate will have the opportunity to support data science projects related to both scientific and business problems', 'Collaborate with NDS subject matter experts to understand data needs and problems', 'Propose and design solutions that support data capture, exploration, modeling, visualization, and/or search', 'Contribute to efforts to ingest and harmonize data from non-clinical drug safety sources', ""Work closely with IT colleagues to evaluate commercially available solutions that augment DOI's capabilities"", 'Create informative and interactive visualizations that enable discovery, support hypotheses, or provide insights into organizational health', 'Employees working in roles that the Company determines require routine collaboration with external stakeholders, such as customer-facing commercial, or research-based roles, will be expected to comply not only with Company policy but also with policies established by such external stakeholders (for example, a requirement to be vaccinated against COVID-19 in order to access a facility or meet with stakeholders)']",,,2023-02-28,Full–time,0.0
"Data Scientist, Crypto Investment Firm",Recruiting from Scratch,"Plymouth, WA, USA", LinkedIn,"Who is Recruiting from Scratch: Recruiting from Scratch is a premier talent firm that focuses on placing the best product managers, software, and hardware talent at innovative companies. Our team is 100% remote and we work with teams across the United States to help them hire. We work with companies funded by the best investors including Sequoia Capital, Lightspeed Ventures, Tiger Global... Management, A16Z, Accel, DFJ, and more. Our Client: Our client is a crypto-focused investment firm. Our client is seeking a Data Scientist to join its investments team. The Data Scientist’s primary responsibility will be to interpret on-chain data and provide data-driven insights that power investment decisions. This will involve owning all parts of our data science tech stack:  Working closely with our engineering team to build efficient ETL pipelines  Building tools and frameworks to provide scalable data-driven insights  Producing data-driven reports to supplement investment decisions The essence of the role is to live at the bleeding edge of interpreting on-chain crypto data. For the first time in history, all of the data related to a growing digital economy is open source and available to anyone. However, this data is messy and underexplored. In this role, you will be responsible for spearheading our exploration and analysis of on-chain crypto data. There will be an emphasis on presenting analyses and findings in a digestible form that influence investment decisions. We are looking for a Data Scientist that can translate data- driven insights into concise, well written reports. We work as a cohesive team and expect everybody at our client to think like an owner, not an agent. While the first few months will involve hands-on training, the Data Scientist must be a self- starter and independent thinker who can operate with minimal supervision. Requirements  1-2 years of product/strategy-oriented data science work experience  Strong quantitative and statistical analysis background, including regression, hypothesis testing, clustering analysis, and network analysis  Proficiency using SQL, Git, and Python/R, including standard libraries such as Pandas, Numpy, and Tidyverse  Proven intuition of translating business problems to statistical problems  Excellent written communication  Demonstrated interest in crypto. If you cannot describe what Bitcoin, Ethereum, and DeFi are, then this role is not a fit. Ideally, you are completely obsessed with crypto  Deep curiosity, strong opinions, and intellectual flexibility. If you do not hold strong opinions and almost always agree with the consensus, then this role is not for you  No unchecked egos. At our client, we all work towards the collective success of the firm, and do not aim for individual recognition. People who care more about building their personal brands than contributing to building a world-class team need not apply.  Must live or be willing to relocate to NYC. We will be working from the office at least four days per week. If you do not meet these requirements, please do not apply. If you believe you do, please include a very short note / send a message along with your application describing your experience and skillset, with particular attention to your level of interest in crypto. Starting salary of $150k with above-market benefits",eyJqb2JfdGl0bGUiOiJEYXRhIFNjaWVudGlzdCwgQ3J5cHRvIEludmVzdG1lbnQgRmlybSIsImh0aWRvY2lkIjoiYmw3Y2h3c1k4SG9BQUFBQUFBQUFBQT09IiwiZ2wiOiJ1ayIsImhsIjoiZW4iLCJhcHBseV9saW5rIjp7InRpdGxlIjoiLm5GZzJlYntmb250LXdlaWdodDo1MDB9LkJpNkRkY3tmb250LXdlaWdodDo1MDB9QXBwbHkgb24gTGlua2VkSW4iLCJsaW5rIjoiaHR0cHM6Ly93d3cubGlua2VkaW4uY29tL2pvYnMvdmlldy9kYXRhLXNjaWVudGlzdC1jcnlwdG8taW52ZXN0bWVudC1maXJtLWF0LXJlY3J1aXRpbmctZnJvbS1zY3JhdGNoLTM0OTQ3MDU0MjM/dXRtX2NhbXBhaWduPWdvb2dsZV9qb2JzX2FwcGx5XHUwMDI2dXRtX3NvdXJjZT1nb29nbGVfam9ic19hcHBseVx1MDAyNnV0bV9tZWRpdW09b3JnYW5pYyJ9fQ==,"['1-2 years of product/strategy-oriented data science work experience', 'Strong quantitative and statistical analysis background, including regression, hypothesis testing, clustering analysis, and network analysis', 'Proficiency using SQL, Git, and Python/R, including standard libraries such as Pandas, Numpy, and Tidyverse', 'Proven intuition of translating business problems to statistical problems', 'Excellent written communication', 'Demonstrated interest in crypto', 'Ideally, you are completely obsessed with crypto', 'Deep curiosity, strong opinions, and intellectual flexibility', 'If you do not hold strong opinions and almost always agree with the consensus, then this role is not for you', 'Must live or be willing to relocate to NYC']","['The Data Scientist’s primary responsibility will be to interpret on-chain data and provide data-driven insights that power investment decisions', 'Working closely with our engineering team to build efficient ETL pipelines', 'Building tools and frameworks to provide scalable data-driven insights', 'Producing data-driven reports to supplement investment decisions', 'In this role, you will be responsible for spearheading our exploration and analysis of on-chain crypto data', 'There will be an emphasis on presenting analyses and findings in a digestible form that influence investment decisions']",['Starting salary of $150k with above-market benefits'],,2023-02-28,Full–time,0.0
Informatics Data Science Engineer,Florida Cancer Specialists,"Tampa, FL, USA", JobServe,"Job Description Summary: Under the direction of the Data Science & Analytics Manager (DSAM), the Data Scientist (DSE) will be transformational in bringing data analytics and Data as a Service (DaaS) to Florida Cancer Specialists. The Data Scientist (DSE) possesses healthcare domain knowledge combined with statistical data expertise to develop Florida Cancer Specialists data platform to further... cancer research. The Data Scientist works cross functionally with the 'trusted data' and DaaS teams to provide guidance as to how best to surface data science insights with an application. As a Data Scientist (DSE) you will be engaged in analysis, code development, data integration and performance optimization initiatives to provide data science insights to users. A Data Science Engineer (DSE) functions in both a consultative and technical capacity to deliver highly dimensional data intensive concepts. To thrive on the FCS Informatics team the Data Scientist (DSE) must be an active contributor in a cross-functional entrepreneurial agile scrum environment to deliver in demand agile analytics. Demonstrates working knowledge of all facets of role, relevant regulations, and organizational and departmental policies and procedures. Performs other duties and projects as assigned. Performs all duties in accordance with regulatory requirements and organizational policies and procedures. Position Qualifications/Requirements Education:  Bachelor's degree in business analytics, computer science, engineering, accounting, finance, management information systems or another related field. In lieu of degree, 10+ years of experience is required or the equivalent combination for education and experience Certifications/Licenses:  Enter required licensure or N/A  Enter required certification or N/A Previous Experience:  5+ Years professional experience in data science application initiatives with technical competencies as an engineer to present the right data in user workflow to make informed decisions  Proven understanding of how to examine data from multiple disparate sources to present data science concepts in scalable applications that drive data sets and visualizations Core Capabilities:  PHP Developer skills performant in writing code, developing portals and database optimization  Competency in PHP web frameworks including Yii, Laravel, and CodeIgniter  Knowledge of Front End technologies including CSS3, JavaScript, and HTML5.  Understanding of object-oriented PHP programming.  Proficient with code versioning tools including Git, Mercurial, CVS, and SVN.  Familiarity with SQL/NoSQL databases. Computer Skills:  PHP web framework, object-oriented programming and code development  Front end technologies  Familiarity with NLP technologies.  Data governance software knowledge (eg, Informatica, etc.)  MS Office Word, Excel, Power Point, and Outlook Travel:  25% Standard Core Workdays/Hours:  Monday to Friday 8:00 AM - 5:00 PM",eyJqb2JfdGl0bGUiOiJJbmZvcm1hdGljcyBEYXRhIFNjaWVuY2UgRW5naW5lZXIiLCJodGlkb2NpZCI6IjZyU0t5QjdFblVNQUFBQUFBQUFBQUE9PSIsImdsIjoidWsiLCJobCI6ImVuIiwiYXBwbHlfbGluayI6eyJ0aXRsZSI6IkFwcGx5IG9uIEpvYlNlcnZlIiwibGluayI6Imh0dHBzOi8vd3d3LmpvYnNlcnZlLmNvbS9nYi9lbi9zZWFyY2gtam9icy1pbi1UYW1wYSwtRmxvcmlkYSwtVVNBL0lORk9STUFUSUNTLURBVEEtU0NJRU5DRS1FTkdJTkVFUi0wMDBENTBBMjg1NENENkUwQ0QvP3V0bV9jYW1wYWlnbj1nb29nbGVfam9ic19hcHBseVx1MDAyNnV0bV9zb3VyY2U9Z29vZ2xlX2pvYnNfYXBwbHlcdTAwMjZ1dG1fbWVkaXVtPW9yZ2FuaWMifX0=,"[""Bachelor's degree in business analytics, computer science, engineering, accounting, finance, management information systems or another related field"", 'In lieu of degree, 10+ years of experience is required or the equivalent combination for education and experience Certifications/Licenses:', 'Enter required licensure or N/A', 'Enter required certification or N/A Previous Experience:', '5+ Years professional experience in data science application initiatives with technical competencies as an engineer to present the right data in user workflow to make informed decisions', 'Proven understanding of how to examine data from multiple disparate sources to present data science concepts in scalable applications that drive data sets and visualizations Core Capabilities:', 'PHP Developer skills performant in writing code, developing portals and database optimization', 'Competency in PHP web frameworks including Yii, Laravel, and CodeIgniter', 'Knowledge of Front End technologies including CSS3, JavaScript, and HTML5', 'Understanding of object-oriented PHP programming', 'Proficient with code versioning tools including Git, Mercurial, CVS, and SVN', 'Familiarity with SQL/NoSQL databases', 'PHP web framework, object-oriented programming and code development', 'Familiarity with NLP technologies', 'Data governance software knowledge (eg, Informatica, etc.)', 'MS Office Word, Excel, Power Point, and Outlook Travel:', '25% Standard Core Workdays/Hours:']","[""The Data Scientist works cross functionally with the 'trusted data' and DaaS teams to provide guidance as to how best to surface data science insights with an application"", 'As a Data Scientist (DSE) you will be engaged in analysis, code development, data integration and performance optimization initiatives to provide data science insights to users', 'A Data Science Engineer (DSE) functions in both a consultative and technical capacity to deliver highly dimensional data intensive concepts', 'To thrive on the FCS Informatics team the Data Scientist (DSE) must be an active contributor in a cross-functional entrepreneurial agile scrum environment to deliver in demand agile analytics', 'Demonstrates working knowledge of all facets of role, relevant regulations, and organizational and departmental policies and procedures', 'Performs other duties and projects as assigned', 'Performs all duties in accordance with regulatory requirements and organizational policies and procedures', 'Monday to Friday 8:00 AM - 5:00 PM']",,,2023-02-27,Full–time,0.0
