title,company_name,location,via,description,job_id,qualifications,responsibilities,benefits,highlights,posted_at,schedule_type,work_from_home
"Associate Director, AI Research for Omics, Oncology Data Science",10001249 - Associate Principal Informatician,"Gaithersburg, MD, USA", AstraZeneca Careers,"This opportunity is available at our Gaithersburg, MD or Waltham, MA locations. Are you passionate about driving insights with data? Do you often ask yourself, if I just had these data, I could...? Do you sometimes imagine what our lives will look like three years from now in these times of the convergence of the AI and the bio revolutions? If the answer is “YES” to all the questions above and... you have an interest for applying Machine Learning/AI in the computational biology space – then we have an exciting opportunity for you. AstraZeneca is a company that always follows the science and turns ideas into life changing medicines. Oncology Data Science plays a unique role in driving drug discovery and translating basic science to clinical practice. We strive to improve the utilization of data to patients’ benefit by leading the adoption and development of computational/data driven approaches to all aspects of the drug discovery process. The Data Science and AI research team in oncology is composed of a diverse group of data scientists, algorithm developers and applied mathematicians working together with computational biologists, bioinformaticians, software engineers, biologists and oncologists to deliver the next drug, next biomarker and next insights to the benefit of cancer patients. Our group is pioneering new Data Science and AI methods and practices to drive drug discovery. As AI is playing a bigger role in our lives, data is becoming more abundant, more diverse and more complex. ML/AI methods and techniques are expending - we need more experts to drive our ground-breaking research to find the right drug, to the right patient at the right time. We are looking for truly skillful people with hands-on ability and clear thinking. People who are ambitious that are not afraid to try out stuff and fail, motivated to make an impact and pioneer new tech and science; a scientist to lead the research and development of new AI methods and practices to drive insights from high dimensional omics data. This is a rare opportunity to lead and develop new approaches combining computational biology and advanced AI, utilizing a breadth of omics data from biobanks and clinical studies to data generated using ex-vivo platforms. The successful execution of this role will directly impact our patients through discovery of biomarkers, informing optimal drug combination and patient selection strategies, discovery of novel oncology targets and furthering our knowledge of cancer biology and evolution. To do this you will:  Design and develop new state-of-the-art methods and algorithms for integration of preclinical, ex-vivo and clinical multi-’omic data. These methods include but are not limited to using dimensionality reduction, representation learning and other techniques, both from classical ML and DL best practices.  Combine expertise in AI methodology development and computational biology knowledge to invent new algorithms that will advance our capabilities to solve problems in high dimensional biological/molecular data.  Partner closely with scientists across translational medicine, bioscience, software engineering and bioinformatics to shape together the AI multi-omics strategy to drive biological insights.  Communicate results, methods and practices to teams across the organization.  Publish results in scientific journals and present in scientific conferences.  Work in a dynamic and multidisciplinary research environment, adapt quickly to new technologies and methods. Minimum Qualifications:  A Bachelor and a PhD in a multidisciplinary subject area at the intersection of data science and biology (e.g. computational biology, bioinformatics, quantitative biology, etc.) OR a combination of quantitative and biological sciences (e.g. Bachelor in computer science and a PhD in Biology or an MD) OR A Bachelor and a PhD in quantitative sciences (e.g. computer science, math, stats, ML/AI, Physics, computational biology, engineering)  3 years demonstrated experience in computational biology  Demonstrated strong technical skills including: applying and developing methods and algorithms in ML/AI, data sciences best practices, problem solving and analytical thinking.  At least 3 years of experience in biopharma/biotech/hitech industry or academia developing methods in data science and AI.  At least 2 years of experience in working with omics related data (e.g. genomics, scRNAseq).  Excellent Data Wrangling skills.  Excellent communication skills.  R and/or Python programming expertise in a Unix environment making use of high-performance computing environments. Desirable Qualifications:  Publications in the field of DS & AI and/or computational biology.  Excellent academic record. Why AstraZeneca At AstraZeneca when we see an opportunity for change, we seize it and make it happen, because any opportunity no matter how small, can be the start of something big. Delivering life-changing medicines is about being entrepreneurial - finding those moments and recognising their potential. Join us on our journey of building a new kind of organisation to reset expectations of what a bio-pharmaceutical company can be. This means we’re opening new ways to work, pioneering cutting edge methods and bringing unexpected teams together. Interested? Come and join our journey. So, what’s next? Are you ready to bring new ideas and fresh thinking to the table? Brilliant! We have one seat available and we hope it’s yours. Where can I find out more? Our Social Media, Follow AstraZeneca on LinkedIn https://www.linkedin.com/company/1603/ Follow AstraZeneca on Facebook https://www.facebook.com/astrazenecacareers/ Follow AstraZeneca on Instagram https://www.instagram.com/astrazeneca_careers/?hl=en AstraZeneca embraces diversity and equality of opportunity. We are committed to building an inclusive and diverse team representing all backgrounds, with as wide a range of perspectives as possible, and harnessing industry-leading skills. We believe that the more inclusive we are, the better our work will be. We welcome and consider applications to join our team from all qualified candidates, regardless of their characteristics. We comply with all applicable laws and regulations on non-discrimination in employment (and recruitment), as well as work authorization and employment eligibility verification requirements. AstraZeneca requires all US employees to be fully vaccinated for COVID-19 but will consider requests for reasonable accommodations as required by applicable law",eyJqb2JfdGl0bGUiOiJBc3NvY2lhdGUgRGlyZWN0b3IsIEFJIFJlc2VhcmNoIGZvciBPbWljcywgT25jb2xvZ3kgRGF0YSBTY2llbmNlIiwiaHRpZG9jaWQiOiJ0S0FieGNySUNtMEFBQUFBQUFBQUFBPT0iLCJnbCI6InVrIiwiaGwiOiJlbiIsImFwcGx5X2xpbmsiOnsidGl0bGUiOiIubkZnMmVie2ZvbnQtd2VpZ2h0OjUwMH0uQmk2RGRje2ZvbnQtd2VpZ2h0OjUwMH1BcHBseSBvbiBBc3RyYVplbmVjYSBDYXJlZXJzIiwibGluayI6Imh0dHBzOi8vY2FyZWVycy5hc3RyYXplbmVjYS5jb20vam9iL2dhaXRoZXJzYnVyZy9hc3NvY2lhdGUtZGlyZWN0b3ItYWktcmVzZWFyY2gtZm9yLW9taWNzLW9uY29sb2d5LWRhdGEtc2NpZW5jZS83Njg0LzQ1MjUxODg5MjgwP3V0bV9jYW1wYWlnbj1nb29nbGVfam9ic19hcHBseVx1MDAyNnV0bV9zb3VyY2U9Z29vZ2xlX2pvYnNfYXBwbHlcdTAwMjZ1dG1fbWVkaXVtPW9yZ2FuaWMifX0=,"['People who are ambitious that are not afraid to try out stuff and fail, motivated to make an impact and pioneer new tech and science; a scientist to lead the research and development of new AI methods and practices to drive insights from high dimensional omics data', 'A Bachelor and a PhD in a multidisciplinary subject area at the intersection of data science and biology (e.g. computational biology, bioinformatics, quantitative biology, etc.)', 'OR a combination of quantitative and biological sciences (e.g. Bachelor in computer science and a PhD in Biology or an MD) OR A Bachelor and a PhD in quantitative sciences (e.g. computer science, math, stats, ML/AI, Physics, computational biology, engineering)', '3 years demonstrated experience in computational biology', 'Demonstrated strong technical skills including: applying and developing methods and algorithms in ML/AI, data sciences best practices, problem solving and analytical thinking', 'At least 3 years of experience in biopharma/biotech/hitech industry or academia developing methods in data science and AI', 'At least 2 years of experience in working with omics related data (e.g. genomics, scRNAseq)', 'Excellent Data Wrangling skills', 'Excellent communication skills', 'R and/or Python programming expertise in a Unix environment making use of high-performance computing environments', 'Publications in the field of DS & AI and/or computational biology', 'Excellent academic record']","['The successful execution of this role will directly impact our patients through discovery of biomarkers, informing optimal drug combination and patient selection strategies, discovery of novel oncology targets and furthering our knowledge of cancer biology and evolution', 'Design and develop new state-of-the-art methods and algorithms for integration of preclinical, ex-vivo and clinical multi-’omic data', 'These methods include but are not limited to using dimensionality reduction, representation learning and other techniques, both from classical ML and DL best practices', 'Combine expertise in AI methodology development and computational biology knowledge to invent new algorithms that will advance our capabilities to solve problems in high dimensional biological/molecular data', 'Partner closely with scientists across translational medicine, bioscience, software engineering and bioinformatics to shape together the AI multi-omics strategy to drive biological insights', 'Communicate results, methods and practices to teams across the organization', 'Publish results in scientific journals and present in scientific conferences', 'Work in a dynamic and multidisciplinary research environment, adapt quickly to new technologies and methods']",,,2023-02-28,Full–time,0.0
Data Scientist,FIS Global,"Cincinnati, OH, USA", FIS Careers,"Position Type : Full time ... Type Of Hire : Experienced (relevant combo of work and education) Education Desired : Master of Science Travel Percentage : 5 - 10% Job Description The world of finance moves fast. At FIS, we’re faster. Our teams are empowered to learn, grow, and make an impact–in their careers and communities. We deliver innovation that advances the way the world pays, banks and invests. If you want to grow personally and professionally, we’d like to know: Are you FIS? About the role: In the Data Scientist role, your skills will be at the core of changing the way the world pays, banks and invests. You’ll analyze, extract and build statistical models from internal and external sources to provide valuable insights into company’s business. You will be working with Sales team, Marketing team and Finance team to provide them insights into Lead generation, Optimum staffing, revenue operations and predicting churn. About the team: Our team is involved in providing real-time high volume, high velocity data and create data warehousing solutions for Finance, Pricing and Revenue Assurance teams for their downstream applications and use cases that help lift revenue and plug leakages across all systems. We provide the solution and technical know-how of all data related technologies and help the company in taking the right technological decisions. We are a team of 40 high performing and highly knowledgeable members across different data cloud platforms viz. AWS, GCP and Azure What you will be doing: • Employ machine learning and statistical modeling to create and enhance data driven products • Analyze and extract insights from internal and external data • Work with Big Data and transform complex datasets into more usable formats • Work with a variety of data science tools and programming languages such as SAS, Python, R, Scala, SQL • Work independently and collaborate with other groups to solve complex problems • Create and present analyses to internal and external partners and clients • Document models and write code to track and monitor models and product performance • Understand the realities of model development and make pragmatic and business-aware choices when trading-off sophistication and accuracy versus implementation and performance costs • Other related duties assigned as needed . What you will need: • Masters or PhD in Statistics, Decision Sciences, Applied Mathematics, Economics or Computer Science or the equivalent combination of education, training, and work experience. • Knowledge in machine learning, artificial intelligence, statistical modeling, data visualization, and data analysis • Proficient in data science tools and programming languages such as SAS, Python, R, Scala, SQL • Experience or knowledge of cloud-based technology • Ability to collaborate with others and solve complex problem • Outstanding verbal and written communication skills to technical and non-technical audiences of various levels in the organization, e.g., executive, management, individual contributors • Excellent analytical, decision-making, problem-solving, team, and time management skills • Ability to persuade and influence others on the best approach • Positive outlook, strong work ethic, and responsive to internal and external clients and contacts • Ability to work as part of a team or alone making a strong contribution in either scenario • Exceptional statistical, mathematical and analytical skills • Delivery-oriented team player who takes responsibility for the team’s success and strives to continually learn and improve • Ability to interface with all levels of employees and effectively interact with various functional areas and facilities • Ability to establish and maintain effective working relationships with employees, management, and clients What we offer you: At FIS, we hire the best. In return, you receive exceptional benefits including:  Opportunities to innovate in fintech  Tools for personal and professional growth  Inclusive and diverse work environment  Resources to invest in your community  Competitive salary and benefits . Privacy Statement FIS is committed to protecting the privacy and security of all personal information that we process in order to provide services to our clients. For specific information on how FIS protects personal information online, please see the Online Privacy Notice. EEOC Statement FIS is an equal opportunity employer. We evaluate qualified applicants without regard to race, color, religion, sex, sexual orientation, gender identity, marital status, genetic information, national origin, disability, veteran status, and other protected characteristics. The EEO is the Law poster is available here supplement document available here For positions located in the US, the following conditions apply. If you are made a conditional offer of employment, you will be required to undergo a drug test. ADA Disclaimer: In developing this job description care was taken to include all competencies needed to successfully perform in this position. However, for Americans with Disabilities Act (ADA) purposes, the essential functions of the job may or may not have been described for purposes of ADA reasonable accommodation. All reasonable accommodation requests will be reviewed and evaluated on a case-by-case basis. Sourcing Model Recruitment at FIS works primarily on a direct sourcing model; a relatively small portion of our hiring is through recruitment agencies. FIS does not accept resumes from recruitment agencies which are not on the preferred supplier list and is not responsible for any related fees for resumes submitted to job postings, our employees, or any other part of our company. #pridepass",eyJqb2JfdGl0bGUiOiJEYXRhIFNjaWVudGlzdCIsImh0aWRvY2lkIjoidkVVNFVlZk4zbkVBQUFBQUFBQUFBQT09IiwiZ2wiOiJ1ayIsImhsIjoiZW4iLCJmYyI6IkV1RUJDcUlCUVVOUWQycHFVV1V6WjFkdE9GQlZaRmhWVVdKYWVVOVBObWg1YUZveFRtMTJUa3Q1VDBNNVJrSTBNemRZZFRGQlJ6UXlUMmRtU3pSd1luTTJOVU41WldweFZYSTROSE4yYVZWVVRqVkxSRFZFZFd4NGQwTjZkaloyTVdKcVJVWjBVRWgyTmsxZmJ5MVpSbXRSV1VoMVYzZ3lhazVRT1hOWldDMWFlbWRDYkd0d1pGOUNUMk4yTW5BMk9TMXhhVlpmUTBOak9IcFJZMHRGVG1RdFFVUnNja2huRWhZdFVWQXRXVFl5ZEVWYVNFMDVRVTl5T1V0RFVVUkJHaUpCUmw4MlRVRlBhRzV3VjNRelJuWXplbGhDT1hNeVMwZFZOVmxpVVhneldWbEIiLCJmY3YiOiIzIiwiZmNfaWQiOiJmY18xIiwiYXBwbHlfbGluayI6eyJ0aXRsZSI6IkFwcGx5IGRpcmVjdGx5IG9uIEZJUyBDYXJlZXJzIiwibGluayI6Imh0dHBzOi8vY2FyZWVycy5maXNnbG9iYWwuY29tL3VzL2VuL2pvYi9GSUdMVVNKUjAyNDA0OThFWFRFUk5BTC9EYXRhLVNjaWVudGlzdD91dG1fY2FtcGFpZ249Z29vZ2xlX2pvYnNfYXBwbHlcdTAwMjZ1dG1fc291cmNlPWdvb2dsZV9qb2JzX2FwcGx5XHUwMDI2dXRtX21lZGl1bT1vcmdhbmljIn19,"['Experienced (relevant combo of work and education)', 'Masters or PhD in Statistics, Decision Sciences, Applied Mathematics, Economics or Computer Science or the equivalent combination of education, training, and work experience', 'Knowledge in machine learning, artificial intelligence, statistical modeling, data visualization, and data analysis', 'Proficient in data science tools and programming languages such as SAS, Python, R, Scala, SQL', 'Experience or knowledge of cloud-based technology', 'Ability to collaborate with others and solve complex problem', 'Outstanding verbal and written communication skills to technical and non-technical audiences of various levels in the organization, e.g., executive, management, individual contributors', 'Excellent analytical, decision-making, problem-solving, team, and time management skills', 'Ability to persuade and influence others on the best approach', 'Positive outlook, strong work ethic, and responsive to internal and external clients and contacts', 'Ability to work as part of a team or alone making a strong contribution in either scenario', 'Exceptional statistical, mathematical and analytical skills', 'Delivery-oriented team player who takes responsibility for the team’s success and strives to continually learn and improve', 'Ability to interface with all levels of employees and effectively interact with various functional areas and facilities', 'Ability to establish and maintain effective working relationships with employees, management, and clients']","['In the Data Scientist role, your skills will be at the core of changing the way the world pays, banks and invests', 'You’ll analyze, extract and build statistical models from internal and external sources to provide valuable insights into company’s business', 'You will be working with Sales team, Marketing team and Finance team to provide them insights into Lead generation, Optimum staffing, revenue operations and predicting churn', 'Employ machine learning and statistical modeling to create and enhance data driven products', 'Work with Big Data and transform complex datasets into more usable formats', 'Work with a variety of data science tools and programming languages such as SAS, Python, R, Scala, SQL', 'Work independently and collaborate with other groups to solve complex problems', 'Create and present analyses to internal and external partners and clients', 'Document models and write code to track and monitor models and product performance', 'Understand the realities of model development and make pragmatic and business-aware choices when trading-off sophistication and accuracy versus implementation and performance costs', 'Other related duties assigned as needed']","['Opportunities to innovate in fintech', 'Tools for personal and professional growth', 'Inclusive and diverse work environment', 'Resources to invest in your community', 'Competitive salary and benefits']",,2023-02-28,Full–time,0.0
