title,company_name,location,via,description,job_id,qualifications,responsibilities,benefits,highlights,posted_at,schedule_type,work_from_home
"Senior Data Scientist, Machine Learning: Platform",Rockstar Games,"New York, NY, USA ", The Muse,"At Rockstar Games, we create world-class entertainment experiences. A career at Rockstar Games is about being part of a team working on some of the most creatively rewarding and ambitious projects to be found in any entertainment medium. You would be welcomed to a dedicated and inclusive environment where you can learn and collaborate with some of the most talented people in the... industry. Rockstar San Diego is on the lookout for talented Data Scientists with strong software development skills who possess a passion for both games, and big data. This is a full-time permanent position based out of Rockstar’s unique game development studio in Carlsbad, CA. WHAT WE DO  The Rockstar Analytics team provide insights and actionable results to a wide variety of stakeholders across the organization in support of their decision making.  We partner with multiple departments across the company to design and implement data and pipelines.  We collaborate as a global team to develop cutting-edge data pipelines, data products, data models, reports, analyses, and machine learning applications.  The ML Platform vertical on the Analytics Team is tasked to build out high impact ML products for internal tooling and for personalizing in-game experiences for our players.  We design, build, and maintain the foundational infrastructure of Rockstar’s Player Analytics ML platform.  We work alongside an exploding team of innovative data-driven decision makers directly impacting Rockstar’s future. RESPONSIBILITIES  Build out foundational high impact infrastructure and tooling to enable Rockstar to leverage modern ML practices to drive company-wide strategy.  Build common library tooling to enable data science staff to easily use Big Data and Cloud resources with a high level of abstraction.  Collaborate closely with internal Data Science members and external stakeholders to ensure we leverage ML to provide the best player experience for our critical titles.  Build standard toolsets for entry to resources across Machine Learning Engineers and Data Scientists, following proper Python OOD best practices.  Design, develop, and maintain product-level Machine Learning application packages in an Agile product-focused CI/CD environment.  Use and optimize advanced distributed techniques to automate continuous training pipelines for traditional and Deep Learning (DL) models.  Remain current with state of the industry to ensure products are meeting modern DL/ML standards and best practices Innovate and produce top quality ML data applications that are easy to iterate as stakeholder requirements evolve. QUALIFICATIONS  5+ years in data science or similar role in the gaming, marketing, finance, or technology fields required.  5+ years of experience in machine learning application development with Python.  Strong understanding of distributed computing and cloud tech for machine learning products.  Bachelor’s degree in Computer Science or related field, with a strong quantitative background.  Extensive experience designing and developing ML pipelines for distributed training on billions of rows of high dimensional data through to production.  Experience designing and developing cloud-based PySpark applications.  Experience with back-end infrastructure for serving models at batch and real time with unified code base.  Deep knowledge of ML algorithms for supervised regression and classification tasks, unsupervised tasks, reinforcement learning tasks, as well as bagging, boosting, and stacking ensemble techniques.  Experience developing cloud-based infrastructure tooling following proper Software Development Lifecycle practices.  Understanding of Docker for application packaging and versioning.  Experience building and working with infrastructure central to MLOps and how MLFlow manages the model lifecycle for model lineage tracking and environment agnostic model containerization. SKILLS  Strong skills in diagramming complex data application architecture and data flows.  Good understanding of practical deep learning techniques and implementation schemes.  Ability to develop and maintain good relations and communicate with people at all hierarchical levels.  Proficiency in statistics such as distributions, predictive modeling, data validation, statistical testing, and regression.  Strong problem-solving skills.  Ability to reconcile technical and business perspectives.  Autonomy and entrepreneurship.  Strong team spirit. PLUSES Please note that these are desirable skills and are not required to apply for the position.  Experience with Azure ML & other base Azure Services.  Experience with Databricks, MLFlow.  Experience serving models for real-time applications.  Experience with Snowflake.  Graduate degree (MSc or Master’s, PHD), an asset.  Game industry experience strongly desired. ADDITIONAL INFORMATION This position can be based out of either our San Diego or NYC studios. HOW TO APPLY Please apply with a resume demonstrating how you meet the skills above. If we would like to move forward with your application, a Rockstar recruiter will reach out to you to explain next steps and guide you through the process. Rockstar is proud to be an equal opportunity employer, and we are committed to hiring, promoting, and compensating employees based on their qualifications and demonstrated ability to perform job responsibilities. If you’ve got the right skills for the job, we want to hear from you. We encourage applications from all suitable candidates regardless of age, disability, gender identity, sexual orientation, religion, belief, or race. The pay range for this position in San Diego at the start of employment is expected to be between the range below* per year. However, base pay offered is based on market location, and may vary further depending on individualized factors for job candidates, such as job-related knowledge, skills, experience, and other objective business considerations. Subject to those same considerations, the total compensation package for this position may also include other elements, including a bonus and/or equity awards, in addition to a full range of medical, financial, and/or other benefits. Details of participation in these benefit plans will be provided if an employee receives an offer of employment. If hired, employee will be in an ""at-will position"" and the company reserves the right to modify base salary (as well as any other discretionary payment or compensation or benefit program) at any time, including for reasons related to individual performance, company or individual department/team performance, and market factors.  San Diego Pay Range $120,500—$168,700 USD",eyJqb2JfdGl0bGUiOiJTZW5pb3IgRGF0YSBTY2llbnRpc3QsIE1hY2hpbmUgTGVhcm5pbmc6IFBsYXRmb3JtIiwiaHRpZG9jaWQiOiJsQzl2S21wOWs3WUFBQUFBQUFBQUFBPT0iLCJnbCI6InVrIiwiaGwiOiJlbiIsImZjIjoiRXVFQkNxSUJRVU5RZDJwcVUxOWhabkJSVUhCeE16ZFlOa1l5WDJjMWVtY3dlRjlqVG14WVMwOUNSMm90YjFoMGRqRmhjMlpCV25NemFDMVlSazFJTVVOdWNreHlRM2hSUlZSQlNWRldZVFZ3UWs1b2VFMVlaRWt5WlRoUlRIcGtUMEZGTTFkR056TkNNRWd0WlcxZmFuUkRka2h0UkhwWVlVWjZSVEZFUm14WWFuRnFkRXczYVMxRmRrSnRSVWxmVFVkNE1rRnpWM05QVjBSNFowZDRhRU5JZEhGRU5HTm5FaFl0VVZBdFdUWXlkRVZhU0UwNVFVOXlPVXREVVVSQkdpSkJSbDgyVFVGUFVVUk5TWGRWYkRSUmIycDJNREIxVW1aeFEySXhUMkZ6VEZOQiIsImZjdiI6IjMiLCJmY19pZCI6ImZjXzQiLCJhcHBseV9saW5rIjp7InRpdGxlIjoiQXBwbHkgb24gVGhlIE11c2UiLCJsaW5rIjoiaHR0cHM6Ly93d3cudGhlbXVzZS5jb20vam9icy9yb2Nrc3RhcmdhbWVzL3Nlbmlvci1kYXRhLXNjaWVudGlzdC1tYWNoaW5lLWxlYXJuaW5nLXBsYXRmb3JtLTRmMjNlMz91dG1fY2FtcGFpZ249Z29vZ2xlX2pvYnNfYXBwbHlcdTAwMjZ1dG1fc291cmNlPWdvb2dsZV9qb2JzX2FwcGx5XHUwMDI2dXRtX21lZGl1bT1vcmdhbmljIn19,"['5+ years in data science or similar role in the gaming, marketing, finance, or technology fields required', '5+ years of experience in machine learning application development with Python', 'Strong understanding of distributed computing and cloud tech for machine learning products', 'Bachelor’s degree in Computer Science or related field, with a strong quantitative background', 'Extensive experience designing and developing ML pipelines for distributed training on billions of rows of high dimensional data through to production', 'Experience designing and developing cloud-based PySpark applications', 'Experience with back-end infrastructure for serving models at batch and real time with unified code base', 'Deep knowledge of ML algorithms for supervised regression and classification tasks, unsupervised tasks, reinforcement learning tasks, as well as bagging, boosting, and stacking ensemble techniques', 'Experience developing cloud-based infrastructure tooling following proper Software Development Lifecycle practices', 'Understanding of Docker for application packaging and versioning', 'Experience building and working with infrastructure central to MLOps and how MLFlow manages the model lifecycle for model lineage tracking and environment agnostic model containerization', 'Strong skills in diagramming complex data application architecture and data flows', 'Good understanding of practical deep learning techniques and implementation schemes', 'Ability to develop and maintain good relations and communicate with people at all hierarchical levels', 'Proficiency in statistics such as distributions, predictive modeling, data validation, statistical testing, and regression', 'Strong problem-solving skills', 'Ability to reconcile technical and business perspectives', 'Autonomy and entrepreneurship', 'Strong team spirit', 'Experience with Azure ML & other base Azure Services', 'Experience with Databricks, MLFlow', 'Experience serving models for real-time applications', 'Experience with Snowflake', 'Graduate degree (MSc or Master’s, PHD), an asset']","['We collaborate as a global team to develop cutting-edge data pipelines, data products, data models, reports, analyses, and machine learning applications', 'The ML Platform vertical on the Analytics Team is tasked to build out high impact ML products for internal tooling and for personalizing in-game experiences for our players', 'Build out foundational high impact infrastructure and tooling to enable Rockstar to leverage modern ML practices to drive company-wide strategy', 'Build common library tooling to enable data science staff to easily use Big Data and Cloud resources with a high level of abstraction', 'Collaborate closely with internal Data Science members and external stakeholders to ensure we leverage ML to provide the best player experience for our critical titles', 'Build standard toolsets for entry to resources across Machine Learning Engineers and Data Scientists, following proper Python OOD best practices', 'Design, develop, and maintain product-level Machine Learning application packages in an Agile product-focused CI/CD environment', 'Use and optimize advanced distributed techniques to automate continuous training pipelines for traditional and Deep Learning (DL) models', 'Remain current with state of the industry to ensure products are meeting modern DL/ML standards and best practices Innovate and produce top quality ML data applications that are easy to iterate as stakeholder requirements evolve']","['Subject to those same considerations, the total compensation package for this position may also include other elements, including a bonus and/or equity awards, in addition to a full range of medical, financial, and/or other benefits', 'If hired, employee will be in an ""at-will position"" and the company reserves the right to modify base salary (as well as any other discretionary payment or compensation or benefit program) at any time, including for reasons related to individual performance, company or individual department/team performance, and market factors', '$120,500—$168,700 USD']",,2023-02-28,Full–time,0.0
Data Scientist,Fidelity Investments Careers,"Westlake, TX, USA", Fidelity Careers - Fidelity Investments,"Job Description: The Role... The NextGen Core Brokerage Analytics team is looking for a Data Scientist with experience in Virtual Assistants or chatbots, Natural Language Processing/text analytics, machine learning, various deep learning related technologies, predictive and prescriptive analytics! The Expertise and Skills You Bring  Master’s Degree in Computer Science, Statistics, Data Science or similar technical subject area with at least 2 years significant professional experience, Preferred specialization in Natural Language Processing (NLP) or Computer Vision  Deep understanding of Machine Learning & Deep Learning algorithms  Knowledge of most of the following quantitative fields: Natural Language Processing, Information Retrieval, Machine Comprehension, Question Answering/Conversational AI, Reinforcement Learning, Knowledge Graph, Causal Inference, and Design of Experiment  Statistical and data science programming skills, such as Python and R  Experience in Big Data, search, NLP, and chatbot technologies such as Elasticsearch and Solr  Preferred experience in AWS Sagemaker, AWS Textract  Knowledge of Deep Learning and related tools such as TensorFlow, Keras, MXNET, Pytorch, or H2O is preferred  Experience deploying NLP solutions in a commercial environment The Value You Deliver  Manage and guide data science and data engineering elements of AI projects  Set a strategic direction for data identification, collection and qualification activities  Experience delivering document intelligence use cases that creation value via automation  Lead data analysis for multiple projects with diverse scope and sophisticated business and technical challenges across several business units and functions  Implement new technologies in a production environment with product, IT, and data engineering teams  Present reports and findings to senior level technical and non-technical audiences Fidelity will reasonably accommodate associates with disabilities who need adjustments to participate in the application or interview process, or to perform the essential functions of their job. Please see below for the salary range for work locations in Colorado only: N/A Please see below for the salary range for work locations in New York City, Westchester County, NY and Jersey City, NJ only: $96,000 - $144,000 per year This position is eligible for incentive compensation or an annual bonus opportunity. Please see below for the salary range for work locations in California only: N/A Please see below for the salary range for work locations in Washington only: N/A Certifications: Company Overview Fidelity Investments is a privately held company with a mission to strengthen the financial well-being of our clients. We help people invest and plan for their future. We assist companies and non-profit organizations in delivering benefits to their employees. And we provide institutions and independent advisors with investment and technology solutions to help invest their own clients’ money. Join Us At Fidelity, you’ll find endless opportunities to build a meaningful career that positively impacts peoples’ lives, including yours. You can take advantage of flexible benefits that support you through every stage of your career, empowering you to thrive at work and at home. Honored with a Glassdoor Employees’ Choice Award, we have been recognized by our employees as a Best Place to Work in 2023. And you don’t need a finance background to succeed at Fidelity—we offer a range of opportunities for learning so you can build the career you’ve always imagined. At Fidelity, our goal is for most people to work flexibly in a way that balances both personal and business needs with time onsite and offsite through what we’re calling ""Dynamic Working."" We invite you to Find Your Fidelity at fidelitycareers.com. Fidelity Investments is an equal opportunity employer. We believe that the most effective way to attract, develop and retain a diverse workforce is to build an enduring culture of inclusion and belonging. Fidelity will reasonably accommodate applicants with disabilities who need adjustments to participate in the application or interview process. To initiate a request for an accommodation, contact the HR Accommodation Team by sending an email to accommodations @fmr.com, or by calling 800-835-5099, prompt 2, option 3",eyJqb2JfdGl0bGUiOiJEYXRhIFNjaWVudGlzdCIsImh0aWRvY2lkIjoiYmxEMHFqaEdoV1FBQUFBQUFBQUFBQT09IiwiZ2wiOiJ1ayIsImhsIjoiZW4iLCJmYyI6IkVvc0NDc3dCUVVOUWQycHFWRGhHWkROc1oxRldOa2RPU25kWVNreHlhVUpNTTFOTGR6TjJSVEpIVkdkQ1VUTkNOR2xKYWxCS1NYUjVia0pRVkUxWFdYbHJhekZXZGt4VVVIaEZZazUyVm1wWmNHVnRWVkJmZVRoTlRHaFVlSFV4Y1hCNFVtcEVWbWx1U1U5dVZUQldNUzFyUlhFMmNXWkZSWHBQYkhwSlNWbGplVlE1VDBaa01FWlRabU5uYW5GRVRsTTFhMmRMUW1OUlUxUlFhSGRKYmxoS2VIWkNPVFJEU2xORWFFVXhTek0zTUhKS1RFZ3RYMUF4TWpsMlUyc3lUSG81VWs0MGMyZFpXWHBKVVVwcU9Va3dFaFl0VVZBdFdUWXlkRVZhU0UwNVFVOXlPVXREVVVSQkdpSkJSbDgyVFVGUVVWSm9TMVZuUzBkUGFuWlJZbTQxYTNZeUxXWk5SMnhLYmxKUiIsImZjdiI6IjMiLCJmY19pZCI6ImZjXzUiLCJhcHBseV9saW5rIjp7InRpdGxlIjoiQXBwbHkgb24gRmlkZWxpdHkgQ2FyZWVycyAtIEZpZGVsaXR5IEludmVzdG1lbnRzIiwibGluayI6Imh0dHBzOi8vam9icy5maWRlbGl0eS5jb20vam9iLWRldGFpbHMvMTc4Njc2MzcvZGF0YS1zY2llbnRpc3QvP3V0bV9jYW1wYWlnbj1nb29nbGVfam9ic19hcHBseVx1MDAyNnV0bV9zb3VyY2U9Z29vZ2xlX2pvYnNfYXBwbHlcdTAwMjZ1dG1fbWVkaXVtPW9yZ2FuaWMifX0=,"['Deep understanding of Machine Learning & Deep Learning algorithms', 'Knowledge of most of the following quantitative fields: Natural Language Processing, Information Retrieval, Machine Comprehension, Question Answering/Conversational AI, Reinforcement Learning, Knowledge Graph, Causal Inference, and Design of Experiment', 'Statistical and data science programming skills, such as Python and R', 'Experience in Big Data, search, NLP, and chatbot technologies such as Elasticsearch and Solr', 'Experience deploying NLP solutions in a commercial environment']","['Manage and guide data science and data engineering elements of AI projects', 'Set a strategic direction for data identification, collection and qualification activities', 'Implement new technologies in a production environment with product, IT, and data engineering teams', 'Present reports and findings to senior level technical and non-technical audiences', 'Fidelity will reasonably accommodate associates with disabilities who need adjustments to participate in the application or interview process, or to perform the essential functions of their job']","['$96,000 - $144,000 per year', 'This position is eligible for incentive compensation or an annual bonus opportunity', 'You can take advantage of flexible benefits that support you through every stage of your career, empowering you to thrive at work and at home']",,2023-02-28,Full–time,0.0
Data Scientist,Test,"New York, NY, USA", Harnham,"Data Scientist New York, New York... $120,000 – $140,000 + Benefits THE COMPANY A New York-based Nonprofit Educational Organization, that is engrained in the local community is actively looking for a Data Scientist to lead their growing Data Science team. This individual will be working in a fast-paced agile environment with the ability to make a visible change to the organization’s overall data function. RESPONSIBILITIES  Analyze life cycle and lifetime value to make recommendations to Marketing, Revenue, Acquisition, and Retention teams.  Support the development of ongoing data and research initiatives with proactive changes.  Deliver end-to-end implementation of data science tasks including algorithm development, dashboarding, research, and insights into the needs of students, families, and educational stakeholders.  Determine KPIs that most appropriately measure effectiveness against competitors.  Collaborate with the Analytics and Engineering teams to advance and implement organization-wide reporting and dashboards. YOUR SKILLS AND EXPERIENCE A successful Data Scientist will likely have the following skills and experience:  Minimum Master’s degree in Statistics, Data Science, Mathematics, Economics, or a related field. Ph.D. is strongly preferred.  Strong Machine Learning, predictive modeling, and statistical analysis skills; NLP is a plus.  Proven experience in data analysis in a customer relationship management, marketing, or consumer research environment.  Highly functional knowledge of Python/R, SQL, and Machine Learning libraries.  Strong presentation and data visualization skills to communicate data analysis in compelling ways to an executive audience  Strong collaboration and communication skills. BENEFITS A competitive base salary of $120,000-140,000 + benefits HOW TO APPLY Please register your interest by sending your résumé to Quentin Abramo via the Apply link on this page. KEYWORDS EdTech, Education, Machine Learning, Data Science, Research, Technology, Marketing, Advertising, Stakeholder Management, Client Facing, Analytics, Predictive Modeling, ML, Python, R, SQL, Statistics",eyJqb2JfdGl0bGUiOiJEYXRhIFNjaWVudGlzdCIsImh0aWRvY2lkIjoiZXVjejkzZXVJNTBBQUFBQUFBQUFBQT09IiwiZ2wiOiJ1ayIsImhsIjoiZW4iLCJhcHBseV9saW5rIjp7InRpdGxlIjoiQXBwbHkgb24gSGFybmhhbSIsImxpbmsiOiJodHRwczovL3d3dy5oYXJuaGFtLmNvbS9qb2IvZGF0YS1zY2llbnRpc3QtbmV3LXlvcmstMi8/dXRtX2NhbXBhaWduPWdvb2dsZV9qb2JzX2FwcGx5XHUwMDI2dXRtX3NvdXJjZT1nb29nbGVfam9ic19hcHBseVx1MDAyNnV0bV9tZWRpdW09b3JnYW5pYyJ9fQ==,"['A successful Data Scientist will likely have the following skills and experience:', 'Minimum Master’s degree in Statistics, Data Science, Mathematics, Economics, or a related field']","['This individual will be working in a fast-paced agile environment with the ability to make a visible change to the organization’s overall data function', 'Analyze life cycle and lifetime value to make recommendations to Marketing, Revenue, Acquisition, and Retention teams', 'Support the development of ongoing data and research initiatives with proactive changes', 'Deliver end-to-end implementation of data science tasks including algorithm development, dashboarding, research, and insights into the needs of students, families, and educational stakeholders', 'Determine KPIs that most appropriately measure effectiveness against competitors', 'Collaborate with the Analytics and Engineering teams to advance and implement organization-wide reporting and dashboards']","['$120,000 – $140,000 + Benefits', 'A competitive base salary of $120,000-140,000 + benefits']",,2023-02-28,Full–time,0.0
