title,company_name,location,via,description,detected_extensions,highlights,responsibilities,qualifications,benefits,job_id
"Data Scientist - £70,000 - Edinburgh Hybrid",In Technology Group Limited,Edinburgh, reed.co.uk,"Data Scientist | Edinburgh We are a recruitment agency seeking an experienced Data Scientist to join a leading tech company in Edinburgh. The successful candidate will be responsible for developing and deploying advanced analytics techniques, such as machine learning, to help the business make better informed decisions. In addition to this, the Data Scientist will be responsible for creating predictive models and helping to identify opportunities for improvement. The ideal candidate will have a strong background in statistical analysis, machine learning and data mining, as well as experience working with large datasets. The successful candidate should possess:  A degree in a related field such as mathematics, statistics or computer science  At least 5 years' experience in a data science role  Expertise in machine learning algorithms, data mining, and statistical modelling  Experience working with big data technologies  Knowledge of programming languages such as Python, R, and... SQL  Strong problem-solving and analytical skills  Excellent communication skills This is a great opportunity to join a leading Financial Services company in Edinburgh with an attractive salary of £60,000 - £70,000. If you are interested in this position, please apply for immediate consideration and interview. We look forward to receiving your application and providing further details about the role. Keywords: Data Scientist, Financial Services, Edinburgh, Machine Learning, Data Mining, Statistical Modelling, Python, R, SQL In Technology Group Ltd is acting as an Employment Agency in relation to this vacancy","{'posted_at': '2 days ago', 'schedule_type': 'Full–time'}","[""Data Scientist | Edinburgh\n\nWe are a recruitment agency seeking an experienced Data Scientist to join a leading tech company in Edinburgh.\n\nThe successful candidate will be responsible for developing and deploying advanced analytics techniques, such as machine learning, to help the business make better informed decisions. In addition to this, the Data Scientist will be responsible for creating predictive models and helping to identify opportunities for improvement.\n\nThe ideal candidate will have a strong background in statistical analysis, machine learning and data mining, as well as experience working with large datasets.\n\nThe successful candidate should possess:\n• A degree in a related field such as mathematics, statistics or computer science\n• At least 5 years' experience in a data science role\n• Expertise in machine learning algorithms, data mining, and statistical modelling\n• Experience working with big data technologies\n• Knowledge of programming languages such as Python, R, and... SQL\n• Strong problem-solving and analytical skills\n• Excellent communication skills\n\nThis is a great opportunity to join a leading Financial Services company in Edinburgh with an attractive salary of £60,000 - £70,000.\n\nIf you are interested in this position, please apply for immediate consideration and interview. We look forward to receiving your application and providing further details about the role.\n\nKeywords: Data Scientist, Financial Services, Edinburgh, Machine Learning, Data Mining, Statistical Modelling, Python, R, SQL\n\nIn Technology Group Ltd is acting as an Employment Agency in relation to this vacancy""]",,,,eyJqb2JfdGl0bGUiOiJEYXRhIFNjaWVudGlzdCAtIMKjNzAsMDAwIC0gRWRpbmJ1cmdoIEh5YnJpZCIsImh0aWRvY2lkIjoiOVlQeEJZVXdRNG9BQUFBQUFBQUFBQT09IiwidXVsZSI6IncrQ0FJUUlDSU9WVzVwZEdWa0lFdHBibWRrYjIwIiwiZ2wiOiJ1ayIsImhsIjoiZW4iLCJhcHBseV9saW5rIjp7InRpdGxlIjoiLm5GZzJlYntmb250LXdlaWdodDo1MDB9LkJpNkRkY3tmb250LXdlaWdodDo1MDB9QXBwbHkgb24gcmVlZC5jby51ayIsImxpbmsiOiJodHRwOi8vd3d3LnJlZWQuY28udWsvam9icy9kYXRhLXNjaWVudGlzdC03MDAwMC1lZGluYnVyZ2gtaHlicmlkLzQ5ODIwNzI5P3V0bV9jYW1wYWlnbj1nb29nbGVfam9ic19hcHBseVx1MDAyNnV0bV9zb3VyY2U9Z29vZ2xlX2pvYnNfYXBwbHlcdTAwMjZ1dG1fbWVkaXVtPW9yZ2FuaWMifX0=
Product Owner (Data Science Focus),be-it,Glasgow, Be-IT Ltd,Product Owner – Data Science Background Tech-For-Good Glasgow Hybrid (2 days on site per week) […],"{'posted_at': '1 day ago', 'schedule_type': 'Full–time'}",['Product Owner – Data Science Background Tech-For-Good Glasgow Hybrid (2 days on site per week) […]'],,,,eyJqb2JfdGl0bGUiOiJQcm9kdWN0IE93bmVyIChEYXRhIFNjaWVuY2UgRm9jdXMpIiwiaHRpZG9jaWQiOiJCcGFXUDgtb2syOEFBQUFBQUFBQUFBPT0iLCJ1dWxlIjoidytDQUlRSUNJT1ZXNXBkR1ZrSUV0cGJtZGtiMjAiLCJnbCI6InVrIiwiaGwiOiJlbiIsImFwcGx5X2xpbmsiOnsidGl0bGUiOiJBcHBseSBvbiBCZS1JVCBMdGQiLCJsaW5rIjoiaHR0cHM6Ly9iZS1pdC5jby51ay9qb2JzL3Byb2R1Y3Qtb3duZXItZGF0YS1zY2llbmNlLWZvY3VzLTYxNjYvP3V0bV9jYW1wYWlnbj1nb29nbGVfam9ic19hcHBseVx1MDAyNnV0bV9zb3VyY2U9Z29vZ2xlX2pvYnNfYXBwbHlcdTAwMjZ1dG1fbWVkaXVtPW9yZ2FuaWMifX0=
Data Scientist,MCS Group,Belfast, Nijobfinder,"MCS group is proud to be working with one of the largest Professional Services firms with ambitious plans for their Belfast Data & Analytics practice. This is a position that will afford you the opportunity to advance further, develop faster, grow your experience and hone your craft as a Data Professional as well as contributing to multiple organisations with intelligent data driven solutions in AI. Data Scientist – Various Positions The package:  £40,000-£80,000 depending on experience, with flexibility for the right candidates  Excellent training and development opportunities with real career prospects and continuous learning  Class-leading flexible benefits package with generous bonus payments  Healthcare, Life Assurance and Pension  Hybrid flexibility Data Scientist: As Data Scientist you will be responsible for assisting clients in projects that aim to deliver capability and results operating within a well-supported and collaborative team structure.  Research and... develop solutions in AI while learning new technologies that could be applied for client benefit  Bring your skills and ideas to the table to develop improvements in data science and artificial intelligence  You will work on new projects that make a real difference  Effectively analyse and define business requirements through stakeholder engagement About you:  You will have hands-on experience as a Data Scientist  A good understanding of statistics, probability and algorithm theory  You will have excellent communication skills and a good understanding of stakeholder management  A proven analytical mindset and the ability to develop solutions  Experience in a range of Data Science technologies such as Python, R, Spark, SQL, Azure Databricks, Azure ML, Tensorflow or Scikit-learn  Ideally, experience with development tools such as Jenkins, Docker or Ansible To speak in absolute confidence about this Data Scientist opportunity please send an up to date CV via the link provided or contact Justin Donaldson, Senior Specialist Consultant at MCS Group 028 96 935507","{'posted_at': '5 days ago', 'schedule_type': 'Full–time'}","['MCS group is proud to be working with one of the largest Professional Services firms with ambitious plans for their Belfast Data & Analytics practice. This is a position that will afford you the opportunity to advance further, develop faster, grow your experience and hone your craft as a Data Professional as well as contributing to multiple organisations with intelligent data driven solutions in AI.\n\nData Scientist – Various Positions\n\nThe package:\n• £40,000-£80,000 depending on experience, with flexibility for the right candidates\n• Excellent training and development opportunities with real career prospects and continuous learning\n• Class-leading flexible benefits package with generous bonus payments\n• Healthcare, Life Assurance and Pension\n• Hybrid flexibility\n\nData Scientist:\n\nAs Data Scientist you will be responsible for assisting clients in projects that aim to deliver capability and results operating within a well-supported and collaborative team structure.\n• Research and... develop solutions in AI while learning new technologies that could be applied for client benefit\n• Bring your skills and ideas to the table to develop improvements in data science and artificial intelligence\n• You will work on new projects that make a real difference\n• Effectively analyse and define business requirements through stakeholder engagement\n\nAbout you:\n• You will have hands-on experience as a Data Scientist\n• A good understanding of statistics, probability and algorithm theory\n• You will have excellent communication skills and a good understanding of stakeholder management\n• A proven analytical mindset and the ability to develop solutions\n• Experience in a range of Data Science technologies such as Python, R, Spark, SQL, Azure Databricks, Azure ML, Tensorflow or Scikit-learn\n• Ideally, experience with development tools such as Jenkins, Docker or Ansible\n\nTo speak in absolute confidence about this Data Scientist opportunity please send an up to date CV via the link provided or contact Justin Donaldson, Senior Specialist Consultant at MCS Group 028 96 935507']",,,,eyJqb2JfdGl0bGUiOiJEYXRhIFNjaWVudGlzdCIsImh0aWRvY2lkIjoiQlljRVBVR2ZFc0VBQUFBQUFBQUFBQT09IiwidXVsZSI6IncrQ0FJUUlDSU9WVzVwZEdWa0lFdHBibWRrYjIwIiwiZ2wiOiJ1ayIsImhsIjoiZW4iLCJhcHBseV9saW5rIjp7InRpdGxlIjoiQXBwbHkgZGlyZWN0bHkgb24gTmlqb2JmaW5kZXIiLCJsaW5rIjoiaHR0cHM6Ly93d3cubmlqb2JmaW5kZXIuY28udWsvam9iLzEwMzk3MDUvZGF0YS1zY2llbnRpc3QvP3V0bV9jYW1wYWlnbj1nb29nbGVfam9ic19hcHBseVx1MDAyNnV0bV9zb3VyY2U9Z29vZ2xlX2pvYnNfYXBwbHlcdTAwMjZ1dG1fbWVkaXVtPW9yZ2FuaWMifX0=
Data Scientist,83zero Limited,Derby, Totaljobs,"Data Scientist Salary: £30,000-£40,000 Location: Derby About This is an incredible opportunity to work with a leading, global provider of innovative supply chain solutions. They are looking for a Data scientist to work in a team to deliver world class forecasting and inventory management solutions utilising advanced analytics and Machine Learning. Main responsibilities: Lead Multiple Data Science projects from initial problem statement formulation, data exploration and transformation to application of ML algorithms, integrating with existing business processes and systems in a live environment. Duties involve:  Providing Data science-based solutions to business problems of varying complexity.  Apply Data science, Machine Learning concepts and python development skills to develop Ml models in diverse business domains such as Sales, Forecasting/Planning, Operational Optimisation and Supply Chain Improvements.  Maintain and continuously enhance their Machine Learning Platform... including the extension of forecasting to other business units tackle business issues that require the application of advanced analytics. Essential skills and experience:  Hold a Degree qualification with numerical content or equivalent  Proven experience in management the full life cycle of projects in Data Science & machine learning  Broad knowledge of multiple machine learning frameworks & algorithms  Intermediate level software development skills in Python for data science using best practice quality guidelines  Strong analytical skills with accuracy and attention to detail  Ability to demonstrator stakeholder management and leadership skills  Experience in supply chain and/or logistics environment  Cloud based computing environment To find out more about this opportunity then please apply with your up to date CV to Kiera Rance. 83DATA Limited is a boutique consultancy specialising in Data Science ML, AI, Big Data | Agile Software Development | Project Management within the UK. We provide high quality interim and permanent senior DATA and Tech professionals","{'posted_at': '1 day ago', 'schedule_type': 'Full–time'}","['Data Scientist\nSalary: £30,000-£40,000\nLocation: Derby\n\nAbout\n\nThis is an incredible opportunity to work with a leading, global provider of innovative supply chain solutions. They are looking for a Data scientist to work in a team to deliver world class forecasting and inventory management solutions utilising advanced analytics and Machine Learning.\n\nMain responsibilities:\n\nLead Multiple Data Science projects from initial problem statement formulation, data exploration and transformation to application of ML algorithms, integrating with existing business processes and systems in a live environment. Duties involve:\n• Providing Data science-based solutions to business problems of varying complexity.\n• Apply Data science, Machine Learning concepts and python development skills to develop Ml models in diverse business domains such as Sales, Forecasting/Planning, Operational Optimisation and Supply Chain Improvements.\n• Maintain and continuously enhance their Machine Learning Platform... including the extension of forecasting to other business units tackle business issues that require the application of advanced analytics.\n\nEssential skills and experience:\n• Hold a Degree qualification with numerical content or equivalent\n• Proven experience in management the full life cycle of projects in Data Science & machine learning\n• Broad knowledge of multiple machine learning frameworks & algorithms\n• Intermediate level software development skills in Python for data science using best practice quality guidelines\n• Strong analytical skills with accuracy and attention to detail\n• Ability to demonstrator stakeholder management and leadership skills\n• Experience in supply chain and/or logistics environment\n• Cloud based computing environment\n\nTo find out more about this opportunity then please apply with your up to date CV to Kiera Rance.\n\n83DATA Limited is a boutique consultancy specialising in Data Science ML, AI, Big Data | Agile Software Development | Project Management within the UK. We provide high quality interim and permanent senior DATA and Tech professionals']",,,,eyJqb2JfdGl0bGUiOiJEYXRhIFNjaWVudGlzdCIsImh0aWRvY2lkIjoickJJY3BoZzAxaEVBQUFBQUFBQUFBQT09IiwidXVsZSI6IncrQ0FJUUlDSU9WVzVwZEdWa0lFdHBibWRrYjIwIiwiZ2wiOiJ1ayIsImhsIjoiZW4iLCJhcHBseV9saW5rIjp7InRpdGxlIjoiQXBwbHkgb24gVG90YWxqb2JzIiwibGluayI6Imh0dHBzOi8vd3d3LnRvdGFsam9icy5jb20vam9iL2RhdGEtc2NpZW50aXN0LzgzemVyby1saW1pdGVkLWpvYjk5OTQ0ODkyP3V0bV9jYW1wYWlnbj1nb29nbGVfam9ic19hcHBseVx1MDAyNnV0bV9zb3VyY2U9Z29vZ2xlX2pvYnNfYXBwbHlcdTAwMjZ1dG1fbWVkaXVtPW9yZ2FuaWMifX0=
Data Scientist,ClearML,Anywhere, LinkedIn,"ClearML is a unified, open source platform for continuous machine learning (ML), trusted by forward-thinking Data Scientists, ML Engineers, DevOps, and decision makers at leading Fortune 500, enterprises, academia, and innovative start-ups worldwide. We enable customers to build continuous ML workflows -- from experiment management and orchestration through data management and scheduling, followed by provisioning and serving -- to achieve the fastest time to ML production, fastest time to value, and increased performance. As a member of the Data Science team at ClearML, you will have the opportunity to contribute to our mission of transforming the ML space -- bridging software, machine learning, and automation . Our team is focused on improving the customer experience of our MLOPs platform and tools through data-driven insights, research, and development. In this role, you will work closely with product, engineering, and growth teams to understand how data scientists and machine... learning engineers are using our tools and make recommendations for improving their capabilities. You will also have the opportunity to share your findings and recommendations with organizational leaders, as the Data Science team plays a key role in shaping the overall strategy and culture of the company. By joining ClearML, you will have the chance to be a part of a dynamic team that is dedicated to advancing the field of machine learning and helping ML engineers train high-performing, fair, and reproducible models. Responsibilities:  Partner with the Growth and Product teams to identify ideal users, their behaviors within the product, and ways to optimize the growth team's efforts.  Work with Product Managers to incorporate your expertise in machine learning into the development of new tools and features for data scientists.  Develop data science models and statistical methods to inform business strategy and enhance customer experiences.  Act as a mentor and educator for the entire team by sharing not only the outcomes of your projects, but also the process and methods used, to empower all team members to become data-savvy.  Work together with engineering and product development teams to build and test ML/DL solutions stretching the entire spectrum of ML operationalization from data processing, model training, hyperparameter tuning, deployment, and model management. About you:  Experience in predictive modeling and inferential statistics in a Data Science setting.  Familiarity with causal inference methods and experience in building related models.  Strong skills in working and analyzing real datasets using SQL, Pandas, and data visualization.  Knowledge of growth and product metrics, including modeling, customer segmentation, and customer acquisition.  Basic understanding of deep learning and CV concepts and architectures.  Passion for MLOps and deep learning products and ecosystems. .  A track record of creating well-documented and easy-to-follow code.  Excellent communication skills, including the ability to clearly convey ideas to people with different technical backgrounds.  Strong writing and presentation skills for insights and data visualization.  Knowledge of SQL and Python; familiarity with Scala, Java, or C++ is a plus.  Familiar with Kubernetes and/or perhaps similar container system  Strong math and analytical skills, with business acumen  BSc or BA degree in Computer Science, Engineering or other relevant area; graduate degree in Data Science or other quantitative field is preferred About ClearML ClearML is a unified, open source platform for continuous machine learning (ML), trusted by forward-thinking Data Scientists, ML Engineers, DevOps, and decision makers at leading Fortune 500, enterprises, academia, and innovative start-ups worldwide. We enable customers to build continuous ML workflows -- from experiment management and orchestration through data management and scheduling, followed by provisioning and serving -- to achieve the fastest time to ML production, fastest time to value, and increased performance. In this way, ClearML accelerates ML adoption across business units, helping companies reach their revenue potential and materialize their ML investments. With thousands of deployments and a vibrant, engaged community, ClearML is transforming the ML space -- bridging software, machine learning, and automation. To learn more, visit the company’s website at https://clear.ml","{'posted_at': '10 hours ago', 'schedule_type': 'Full–time', 'work_from_home': True}","[""ClearML is a unified, open source platform for continuous machine learning (ML), trusted by forward-thinking Data Scientists, ML Engineers, DevOps, and decision makers at leading Fortune 500, enterprises, academia, and innovative start-ups worldwide. We enable customers to build continuous ML workflows -- from experiment management and orchestration through data management and scheduling, followed by provisioning and serving -- to achieve the fastest time to ML production, fastest time to value, and increased performance.\n\nAs a member of the Data Science team at ClearML, you will have the opportunity to contribute to our mission of transforming the ML space -- bridging software, machine learning, and automation . Our team is focused on improving the customer experience of our MLOPs platform and tools through data-driven insights, research, and development.\n\nIn this role, you will work closely with product, engineering, and growth teams to understand how data scientists and machine... learning engineers are using our tools and make recommendations for improving their capabilities. You will also have the opportunity to share your findings and recommendations with organizational leaders, as the Data Science team plays a key role in shaping the overall strategy and culture of the company.\n\nBy joining ClearML, you will have the chance to be a part of a dynamic team that is dedicated to advancing the field of machine learning and helping ML engineers train high-performing, fair, and reproducible models.\n\nResponsibilities:\n• Partner with the Growth and Product teams to identify ideal users, their behaviors within the product, and ways to optimize the growth team's efforts.\n• Work with Product Managers to incorporate your expertise in machine learning into the development of new tools and features for data scientists.\n• Develop data science models and statistical methods to inform business strategy and enhance customer experiences.\n• Act as a mentor and educator for the entire team by sharing not only the outcomes of your projects, but also the process and methods used, to empower all team members to become data-savvy.\n• Work together with engineering and product development teams to build and test ML/DL solutions stretching the entire spectrum of ML operationalization from data processing, model training, hyperparameter tuning, deployment, and model management.\n\nAbout you:\n• Experience in predictive modeling and inferential statistics in a Data Science setting.\n• Familiarity with causal inference methods and experience in building related models.\n• Strong skills in working and analyzing real datasets using SQL, Pandas, and data visualization.\n• Knowledge of growth and product metrics, including modeling, customer segmentation, and customer acquisition.\n• Basic understanding of deep learning and CV concepts and architectures.\n• Passion for MLOps and deep learning products and ecosystems. .\n• A track record of creating well-documented and easy-to-follow code.\n• Excellent communication skills, including the ability to clearly convey ideas to people with different technical backgrounds.\n• Strong writing and presentation skills for insights and data visualization.\n• Knowledge of SQL and Python; familiarity with Scala, Java, or C++ is a plus.\n• Familiar with Kubernetes and/or perhaps similar container system\n• Strong math and analytical skills, with business acumen\n• BSc or BA degree in Computer Science, Engineering or other relevant area; graduate degree in Data Science or other quantitative field is preferred\n\nAbout ClearML\n\nClearML is a unified, open source platform for continuous machine learning (ML), trusted by forward-thinking Data Scientists, ML Engineers, DevOps, and decision makers at leading Fortune 500, enterprises, academia, and innovative start-ups worldwide. We enable customers to build continuous ML workflows -- from experiment management and orchestration through data management and scheduling, followed by provisioning and serving -- to achieve the fastest time to ML production, fastest time to value, and increased performance. In this way, ClearML accelerates ML adoption across business units, helping companies reach their revenue potential and materialize their ML investments. With thousands of deployments and a vibrant, engaged community, ClearML is transforming the ML space -- bridging software, machine learning, and automation. To learn more, visit the company’s website at https://clear.ml""]",,,,eyJqb2JfdGl0bGUiOiJEYXRhIFNjaWVudGlzdCIsImh0aWRvY2lkIjoiTG5YRGpwenYwMU1BQUFBQUFBQUFBQT09IiwidXVsZSI6IncrQ0FJUUlDSU9WVzVwZEdWa0lFdHBibWRrYjIwIiwiZ2wiOiJ1ayIsImhsIjoiZW4iLCJhcHBseV9saW5rIjp7InRpdGxlIjoiQXBwbHkgb24gTGlua2VkSW4iLCJsaW5rIjoiaHR0cHM6Ly91ay5saW5rZWRpbi5jb20vam9icy92aWV3L2RhdGEtc2NpZW50aXN0LWF0LWNsZWFybWwtMzQ5NjQ3MDI2Mj91dG1fY2FtcGFpZ249Z29vZ2xlX2pvYnNfYXBwbHlcdTAwMjZ1dG1fc291cmNlPWdvb2dsZV9qb2JzX2FwcGx5XHUwMDI2dXRtX21lZGl1bT1vcmdhbmljIn19
