title,company_name,location,via,description,job_id,qualifications,responsibilities,benefits,highlights,posted_at,schedule_type,work_from_home
Data Scientist,Merck,"West Point, PA, USA ", Merck Careers,"Job Description The Digital Operations and Innovation (DOI) group in the Nonclinical Drug Safety (NDS) Operations department is seeking a motivated Data Scientist to support our efforts to modernize, harmonize, and integrate NDS data. DOI's mission is to advance non-clinical drug safety through the application of data science. Our team's solutions support scientific and business leaders by... facilitating data access, expanding analysis capabilities, and driving novel insights. The candidate will be part of a collaborative team comprised of biologists, chemists, pharmacologists, business/IT professionals, and data scientists. The role will provide essential contributions to our research and development division and NDS' commitment to be an industry leader in the application of data science to impact the evaluation of drug safety. The candidate will have the opportunity to support data science projects related to both scientific and business problems. Job Responsibilities:  Collaborate with NDS subject matter experts to understand data needs and problems  Propose and design solutions that support data capture, exploration, modeling, visualization, and/or search  Contribute to efforts to ingest and harmonize data from non-clinical drug safety sources  Work closely with IT colleagues to evaluate commercially available solutions that augment DOI's capabilities  Create informative and interactive visualizations that enable discovery, support hypotheses, or provide insights into organizational health Minimum education and Experience:  Masters degree with 3+ years' experience or PhD with 0+ years' experience in computer science, computer engineering, biomedical engineering, data science, statistics, or a related field or Required Experience and Skills:  Proficiency building dashboards using one or more visualization tools such as PowerBI, Spotfire, and/or RShiny  Proficiency with programming languages such as Python and R (Python preferred)  Proficiency using data science packages such as Pandas, Numpy, Scikit-learn, and Scipy  Ability to quickly evaluate and integrate new technologies and communicate their value to stakeholders  Strong collaboration and English communication skills  10-20% travel Preferred Experience and Skills:  Experience with SQL, XML, json, and RESTful APIs  Familiarity with data sources, such as Oracle, RedShift, postgres, mongoDB, and/or neo4j  Familiarity with deep learning frameworks such as PyTorch or TensorFlow  Familiarity with graphing packages and languages such as Plotly and D3.js  Experience in distributed or cloud computing environments (AWS, Azure, etc)  Experience with version control and good code reproducibility practices (git, documentation, etc.) We are a research-driven biopharmaceutical company. Our mission is built on the simple premise that if we “follow the science” that great medicines can make a significant impact to our world. We believe that a research-driven enterprise dedicated to world-class science can succeed by inventing medicine and vaccine innovations that make a difference for patients across the globe. Who we are … We are known as Merck & Co., Inc., Rahway, New Jersey, USA in the United States and Canada and MSD everywhere else. For more than a century, we have been inventing for life, bringing forward medicines and vaccines for many of the world's most challenging diseases. Today, our company continues to be at the forefront of research to deliver innovative health solutions and advance the prevention and treatment of diseases that threaten people and animals around the world. What we look for … Imagine getting up in the morning for a job as important as helping to save and improve lives around the world. Here, you have that opportunity. You can put your empathy, creativity, digital mastery, or scientific genius to work in collaboration with a diverse group of colleagues who pursue and bring hope to countless people who are battling some of the most challenging diseases of our time. Our team is constantly evolving, so if you are among the intellectually curious, join us—and start making your impact today. NOTICE FOR INTERNAL APPLICANTS In accordance with Managers' Policy - Job Posting and Employee Placement, all employees subject to this policy are required to have a minimum of twelve (12) months of service in current position prior to applying for open positions. If you have been offered a separation benefits package, but have not yet reached your separation date and are offered a position within the salary and geographical parameters as set forth in the Summary Plan Description (SPD) of your separation package, then you are no longer eligible for your separation benefits package. To discuss in more detail, please contact your HRBP or Talent Acquisition Advisor. Residents of Colorado Click here to request this role’s pay range. Employees working in roles that the Company determines require routine collaboration with external stakeholders, such as customer-facing commercial, or research-based roles, will be expected to comply not only with Company policy but also with policies established by such external stakeholders (for example, a requirement to be vaccinated against COVID-19 in order to access a facility or meet with stakeholders). Please understand that, as permitted by applicable law, if you have not been vaccinated against COVID-19 and an essential function of your job is to call on external stakeholders who require vaccination to enter their premises or engage in face-to-face meetings, then your employment may pose an undue burden to business operations, in which case you may not be offered employment, or your employment could be terminated. Please also note that, where permitted by applicable law, the Company reserves the right to require COVID-19 vaccinations for positions, such as in Global Employee Health, where the Company determines in its discretion that the nature of the role presents an increased risk of disease transmission. Current Employees apply HERE Current Contingent Workers apply HERE US and Puerto Rico Residents Only: Our company is committed to inclusion, ensuring that candidates can engage in a hiring process that exhibits their true capabilities. Please click here if you need an accommodation during the application or hiring process. For more information about personal rights under Equal Employment Opportunity, visit: EEOC Know Your Rights EEOC GINA Supplement​ Pay Transparency Nondiscrimination We are proud to be a company that embraces the value of bringing diverse, talented, and committed people together. The fastest way to breakthrough innovation is when diverse ideas come together in an inclusive environment. We encourage our colleagues to respectfully challenge one another’s thinking and approach problems collectively. We are an equal opportunity employer, committed to fostering an inclusive and diverse workplace. Residents of Colorado: Click here to request this role’s pay range. Learn more about your rights, including under California, Colorado and other US State Acts Search Firm Representatives Please Read Carefully Merck & Co., Inc., Rahway, NJ, USA, also known as Merck Sharp & Dohme LLC, Rahway, NJ, USA, does not accept unsolicited assistance from search firms for employment opportunities. All CVs / resumes submitted by search firms to any employee at our company without a valid written search agreement in place for this position will be deemed the sole property of our company. No fee will be paid in the event a candidate is hired by our company as a result of an agency referral where no pre-existing agreement is in place. Where agency agreements are in place, introductions are position specific. Please, no phone calls or emails. Employee Status: Regular Relocation: Domestic/International VISA Sponsorship: Yes Travel Requirements: 10% Flexible Work Arrangements: Hybrid, Remote Work Shift: 1st - Day Valid Driving License: No Hazardous Material(s): Requisition ID:R226607",eyJqb2JfdGl0bGUiOiJEYXRhIFNjaWVudGlzdCIsImh0aWRvY2lkIjoiaUlobUVtU3NydFFBQUFBQUFBQUFBQT09IiwiZ2wiOiJ1ayIsImhsIjoiZW4iLCJmYyI6IkVzd0JDb3dCUVVOUWQycHFVVkZYZDNSaWNqTnJlR0ZDZUhabFF5MXJkV2hyZEdzNVZ5MUhNV3d4YVVSTVgxTlhZVzVoZEVGTlozZGFZelptWDFoUVEzUTFWV1ZMWldOdVdtTTFTR2QxYjFCeWVFbDVURmhmVGxwSE5UTlpjbXhMU0hGaGFtRnlNWEl6YVVaMmNrNTBWRXc0T0dRMU9ESlFVUzFvUWw5WVlTMDNlVXRTWm1kQ1EyMW9iMk5vU21SeWFHc1NGMDAxVURoWk9YcEVUbEIxZFRWT2IxQm9YekpDZVVGRkdpSkJSbDgyVFVGUE1GbEljSE52ZUZKNFdYcHJabFJMUjA4ek5GVnhRbmswTVRSUiIsImZjdiI6IjMiLCJmY19pZCI6ImZjXzMiLCJhcHBseV9saW5rIjp7InRpdGxlIjoiQXBwbHkgZGlyZWN0bHkgb24gTWVyY2sgQ2FyZWVycyIsImxpbmsiOiJodHRwczovL2pvYnMubWVyY2suY29tL3VzL2VuL2pvYi9SMjI2NjA3L0RhdGEtU2NpZW50aXN0P3V0bV9jYW1wYWlnbj1nb29nbGVfam9ic19hcHBseVx1MDAyNnV0bV9zb3VyY2U9Z29vZ2xlX2pvYnNfYXBwbHlcdTAwMjZ1dG1fbWVkaXVtPW9yZ2FuaWMifX0=,"[""Masters degree with 3+ years' experience or PhD with 0+ years' experience in computer science, computer engineering, biomedical engineering, data science, statistics, or a related field or"", 'Proficiency building dashboards using one or more visualization tools such as PowerBI, Spotfire, and/or RShiny', 'Proficiency using data science packages such as Pandas, Numpy, Scikit-learn, and Scipy', 'Ability to quickly evaluate and integrate new technologies and communicate their value to stakeholders', 'Strong collaboration and English communication skills', '10-20% travel']","[""DOI's mission is to advance non-clinical drug safety through the application of data science"", 'The candidate will be part of a collaborative team comprised of biologists, chemists, pharmacologists, business/IT professionals, and data scientists', ""The role will provide essential contributions to our research and development division and NDS' commitment to be an industry leader in the application of data science to impact the evaluation of drug safety"", 'The candidate will have the opportunity to support data science projects related to both scientific and business problems', 'Collaborate with NDS subject matter experts to understand data needs and problems', 'Propose and design solutions that support data capture, exploration, modeling, visualization, and/or search', 'Contribute to efforts to ingest and harmonize data from non-clinical drug safety sources', ""Work closely with IT colleagues to evaluate commercially available solutions that augment DOI's capabilities"", 'Create informative and interactive visualizations that enable discovery, support hypotheses, or provide insights into organizational health', 'Employees working in roles that the Company determines require routine collaboration with external stakeholders, such as customer-facing commercial, or research-based roles, will be expected to comply not only with Company policy but also with policies established by such external stakeholders (for example, a requirement to be vaccinated against COVID-19 in order to access a facility or meet with stakeholders)']",,,2023-02-28,Full–time,0.0
Data Scientist,Fidelity Investments Careers,"Westlake, TX, USA", Fidelity Careers - Fidelity Investments,"Job Description: The Role... The NextGen Core Brokerage Analytics team is looking for a Data Scientist with experience in Virtual Assistants or chatbots, Natural Language Processing/text analytics, machine learning, various deep learning related technologies, predictive and prescriptive analytics! The Expertise and Skills You Bring  Master’s Degree in Computer Science, Statistics, Data Science or similar technical subject area with at least 2 years significant professional experience, Preferred specialization in Natural Language Processing (NLP) or Computer Vision  Deep understanding of Machine Learning & Deep Learning algorithms  Knowledge of most of the following quantitative fields: Natural Language Processing, Information Retrieval, Machine Comprehension, Question Answering/Conversational AI, Reinforcement Learning, Knowledge Graph, Causal Inference, and Design of Experiment  Statistical and data science programming skills, such as Python and R  Experience in Big Data, search, NLP, and chatbot technologies such as Elasticsearch and Solr  Preferred experience in AWS Sagemaker, AWS Textract  Knowledge of Deep Learning and related tools such as TensorFlow, Keras, MXNET, Pytorch, or H2O is preferred  Experience deploying NLP solutions in a commercial environment The Value You Deliver  Manage and guide data science and data engineering elements of AI projects  Set a strategic direction for data identification, collection and qualification activities  Experience delivering document intelligence use cases that creation value via automation  Lead data analysis for multiple projects with diverse scope and sophisticated business and technical challenges across several business units and functions  Implement new technologies in a production environment with product, IT, and data engineering teams  Present reports and findings to senior level technical and non-technical audiences Fidelity will reasonably accommodate associates with disabilities who need adjustments to participate in the application or interview process, or to perform the essential functions of their job. Please see below for the salary range for work locations in Colorado only: N/A Please see below for the salary range for work locations in New York City, Westchester County, NY and Jersey City, NJ only: $96,000 - $144,000 per year This position is eligible for incentive compensation or an annual bonus opportunity. Please see below for the salary range for work locations in California only: N/A Please see below for the salary range for work locations in Washington only: N/A Certifications: Company Overview Fidelity Investments is a privately held company with a mission to strengthen the financial well-being of our clients. We help people invest and plan for their future. We assist companies and non-profit organizations in delivering benefits to their employees. And we provide institutions and independent advisors with investment and technology solutions to help invest their own clients’ money. Join Us At Fidelity, you’ll find endless opportunities to build a meaningful career that positively impacts peoples’ lives, including yours. You can take advantage of flexible benefits that support you through every stage of your career, empowering you to thrive at work and at home. Honored with a Glassdoor Employees’ Choice Award, we have been recognized by our employees as a Best Place to Work in 2023. And you don’t need a finance background to succeed at Fidelity—we offer a range of opportunities for learning so you can build the career you’ve always imagined. At Fidelity, our goal is for most people to work flexibly in a way that balances both personal and business needs with time onsite and offsite through what we’re calling ""Dynamic Working."" We invite you to Find Your Fidelity at fidelitycareers.com. Fidelity Investments is an equal opportunity employer. We believe that the most effective way to attract, develop and retain a diverse workforce is to build an enduring culture of inclusion and belonging. Fidelity will reasonably accommodate applicants with disabilities who need adjustments to participate in the application or interview process. To initiate a request for an accommodation, contact the HR Accommodation Team by sending an email to accommodations @fmr.com, or by calling 800-835-5099, prompt 2, option 3",eyJqb2JfdGl0bGUiOiJEYXRhIFNjaWVudGlzdCIsImh0aWRvY2lkIjoiYmxEMHFqaEdoV1FBQUFBQUFBQUFBQT09IiwiZ2wiOiJ1ayIsImhsIjoiZW4iLCJmYyI6IkVvd0NDc3dCUVVOUWQycHFVUzA1T0VWeGJtZDNaa04xWkRKblZYSkVXRzlyVDBsSE56SndPRmcyWWpWcE4xazJZbUUwVURkTU16WjBiemRNZERaRVNsTmhkMkY0ZDBwZlRsVXlMVEkyWjBSblRqQnNTazlxWms1VlJrUXpUUzFUV0ZSRmJsZzVUVVU1WTJFemRtWjFTbVJJV1VWWVRqWkhXbXhUTVdFdFZrTllOMlpVWkRSV2VtNU5lRVk0V0hGSmFWbHJTbk0zU0dkWFNFNUljVUkzVkRkRkxXTTVUM2t6WmpoTFZYRXRNM3BRVDFwQlJIZEtUWFZhV2poaVZUSTNRalZLTjJaT1NYbG9TMFEwV0RRd1FWcHVFaGROTlZBNFdUbDZSRTVRZFhVMVRtOVFhRjh5UW5sQlJSb2lRVVpmTmsxQlRVTTFkbWxKUTFGSGJWSjBRV05pVjFaRWJWcFhlRU54ZGpoRlFRIiwiZmN2IjoiMyIsImZjX2lkIjoiZmNfNCIsImFwcGx5X2xpbmsiOnsidGl0bGUiOiJBcHBseSBvbiBGaWRlbGl0eSBDYXJlZXJzIC0gRmlkZWxpdHkgSW52ZXN0bWVudHMiLCJsaW5rIjoiaHR0cHM6Ly9qb2JzLmZpZGVsaXR5LmNvbS9qb2ItZGV0YWlscy8xNzg2NzYzNy9kYXRhLXNjaWVudGlzdC8/dXRtX2NhbXBhaWduPWdvb2dsZV9qb2JzX2FwcGx5XHUwMDI2dXRtX3NvdXJjZT1nb29nbGVfam9ic19hcHBseVx1MDAyNnV0bV9tZWRpdW09b3JnYW5pYyJ9fQ==,"['Deep understanding of Machine Learning & Deep Learning algorithms', 'Knowledge of most of the following quantitative fields: Natural Language Processing, Information Retrieval, Machine Comprehension, Question Answering/Conversational AI, Reinforcement Learning, Knowledge Graph, Causal Inference, and Design of Experiment', 'Statistical and data science programming skills, such as Python and R', 'Experience in Big Data, search, NLP, and chatbot technologies such as Elasticsearch and Solr', 'Experience deploying NLP solutions in a commercial environment']","['Manage and guide data science and data engineering elements of AI projects', 'Set a strategic direction for data identification, collection and qualification activities', 'Implement new technologies in a production environment with product, IT, and data engineering teams', 'Present reports and findings to senior level technical and non-technical audiences', 'Fidelity will reasonably accommodate associates with disabilities who need adjustments to participate in the application or interview process, or to perform the essential functions of their job']","['$96,000 - $144,000 per year', 'This position is eligible for incentive compensation or an annual bonus opportunity', 'You can take advantage of flexible benefits that support you through every stage of your career, empowering you to thrive at work and at home']",,2023-02-28,Full–time,0.0
Principal Data Scientist,Overstory,Anywhere, AngelList,"About the role We are looking for a Principal Data Scientist who is a creative, but pragmatic, problem-solver. Reporting into VP Engineering you will be the most senior Data Scientist on the team. You’ll spend most of your time working autonomously or within a small team, building, improving, and running our models. You will work closely with the CTO setting, planning, and executing the long-term vision for our ML platform. This is a hands-on role that will involve exploring satellite imagery sets and other geographical datasets; using machine learning to analyze the images; and working with the teams to deliver the results to our customers. We have models and pipelines at various stages of maturity and we would expect you to use and apply the results of the stable ones and help us improve and validate the ones still in early development. You will work with the team to implement new ML techniques, models, and algorithms that bring step changes to our analyses. Big part of the role... is using the outputs of our analyses to solve customer needs. You will work closely with our Customer Success team to understand the customers’ problems and then work with other Data Scientists and the rest of the tech team to come up with solutions to those problems. You will help us adapt our models to different customer needs, but also environmental and vegetative factors. On a typical day you could be: running inference on satellite imagery, checking the quality of the output, tweaking the input parameters, and retraining the model with new labels; writing Python code to process and analyze GIS data; researching and incorporating new datasets into your project and sharing findings with the team; reading about the latest Deep Learning techniques and applying them to our datasets. You will have responsibility for your own projects, and we’ll expect you to take initiative to help us improve overall. Whether the work is about forest damage detection, tree species identification or biodiversity monitoring, you are up for the challenge! About you  You are creative and curious.  You are pragmatic, you know when a simple solution is sufficient or when new model development is required.  You are a strong communicator, able to express your ideas succinctly. You make complex ideas accessible to others.  You have an eye for quality, your work is thorough, and you pay attention to both the small details and the larger picture.  Teamwork is at your core, and you like to help others grow and succeed. Requirements  You have at least 8 years of commercial experience as a Data Scientist or Machine Learning Engineer.  You have spent at least 3 years working in a startup environment (preferably early stage).  You have advanced Python experience (including PyTorch and/or Tensorflow).  Experience working with GIS systems and processing GIS data.  Experience processing satellite data and/or imagery. Overstory focuses on Artificial Intelligence, Natural Resources, Agriculture, Sustainability, and Geospatial. Their company has offices in Boston and Amsterdam. They have a small team that's between 11-50 employees. To date, Overstory has raised $5.955M of funding; their latest round was closed on November 2021. You can view their website at http://www.overstory.com or find them on Twitter and LinkedIn",eyJqb2JfdGl0bGUiOiJQcmluY2lwYWwgRGF0YSBTY2llbnRpc3QiLCJodGlkb2NpZCI6IkRxT3BnNEFObHZrQUFBQUFBQUFBQUE9PSIsImdsIjoidWsiLCJobCI6ImVuIiwiYXBwbHlfbGluayI6eyJ0aXRsZSI6IkFwcGx5IGRpcmVjdGx5IG9uIEFuZ2VsTGlzdCIsImxpbmsiOiJodHRwczovL2FuZ2VsLmNvL2NvbXBhbnkvb3ZlcnN0b3J5YWkvam9icy8yNTg4ODA4LXByaW5jaXBhbC1kYXRhLXNjaWVudGlzdD91dG1fY2FtcGFpZ249Z29vZ2xlX2pvYnNfYXBwbHlcdTAwMjZ1dG1fc291cmNlPWdvb2dsZV9qb2JzX2FwcGx5XHUwMDI2dXRtX21lZGl1bT1vcmdhbmljIn19,,,,"[""About the role\n\nWe are looking for a Principal Data Scientist who is a creative, but pragmatic, problem-solver. Reporting into VP Engineering you will be the most senior Data Scientist on the team. You’ll spend most of your time working autonomously or within a small team, building, improving, and running our models. You will work closely with the CTO setting, planning, and executing the long-term vision for our ML platform.\n\nThis is a hands-on role that will involve exploring satellite imagery sets and other geographical datasets; using machine learning to analyze the images; and working with the teams to deliver the results to our customers. We have models and pipelines at various stages of maturity and we would expect you to use and apply the results of the stable ones and help us improve and validate the ones still in early development. You will work with the team to implement new ML techniques, models, and algorithms that bring step changes to our analyses.\n\nBig part of the role... is using the outputs of our analyses to solve customer needs. You will work closely with our Customer Success team to understand the customers’ problems and then work with other Data Scientists and the rest of the tech team to come up with solutions to those problems. You will help us adapt our models to different customer needs, but also environmental and vegetative factors.\n\nOn a typical day you could be: running inference on satellite imagery, checking the quality of the output, tweaking the input parameters, and retraining the model with new labels; writing Python code to process and analyze GIS data; researching and incorporating new datasets into your project and sharing findings with the team; reading about the latest Deep Learning techniques and applying them to our datasets.\n\nYou will have responsibility for your own projects, and we’ll expect you to take initiative to help us improve overall. Whether the work is about forest damage detection, tree species identification or biodiversity monitoring, you are up for the challenge!\n\nAbout you\n• You are creative and curious.\n• You are pragmatic, you know when a simple solution is sufficient or when new model development is required.\n• You are a strong communicator, able to express your ideas succinctly. You make complex ideas accessible to others.\n• You have an eye for quality, your work is thorough, and you pay attention to both the small details and the larger picture.\n• Teamwork is at your core, and you like to help others grow and succeed.\n\nRequirements\n• You have at least 8 years of commercial experience as a Data Scientist or Machine Learning Engineer.\n• You have spent at least 3 years working in a startup environment (preferably early stage).\n• You have advanced Python experience (including PyTorch and/or Tensorflow).\n• Experience working with GIS systems and processing GIS data.\n• Experience processing satellite data and/or imagery.\n\nOverstory focuses on Artificial Intelligence, Natural Resources, Agriculture, Sustainability, and Geospatial. Their company has offices in Boston and Amsterdam. They have a small team that's between 11-50 employees. To date, Overstory has raised $5.955M of funding; their latest round was closed on November 2021.\n\nYou can view their website at http://www.overstory.com or find them on Twitter and LinkedIn""]",2023-02-28,Full–time,1.0
